remoteId,published,modified,Titolo,"Descrizione breve",Descrizione,"Tipologia di luogo",lat,lon,address,Immagine,Comune,Tags,Fonte,Indirizzo,"Indirizzo web",Email,Telefono
96564e1929bcbf6a0a61d22b853eac2e,2014-06-16T13:12:45+02:00,2014-06-16T13:13:29+02:00,"Monte Tombea","Il Monte Tombea è una montagna delle Prealpi Bresciane e Gardesane alta 1976 m. Fa parte del gruppo montuoso che a sud del lago di Ledro si estende tra il lago d'Idro e il lago di Garda ed è composto da ovest a est dal Cingolo Rosso e monte Cingla, Bocca di Val, Bus del Gat, Cortina, Bocca di Cablone, Dosso delle Saette, Cima Tombea, monte Caplone, Bocche di Lorina, Cima del Fratone, Dosso della Fame, Cima del Levrer, monte Lavino, monte Tremalzo, Cima Tuflungo, monte Nota con passo Nota e monte Carone. Lungo la cresta e compresa la Val Vestino (passata nel 1934 dal Trentino alla Lombardia) corre il confine fra il Trentino e la Lombardia, una volta confine di Stato fra Italia e Austria, superato dai Garibaldini nella campagna del 1866, che si concluse con la battaglia di Bezzecca e il telegramma «Obbedisco». Il confine venne definitivamente passato nel 1915 all'entrata in guerra dell'Italia nel primo conflitto mondiale.","Per avere maggiori informazioni sul Monte Tombea visita il sito  ","Località turistica",45.806312,10.550976,Bondone,/var/bondone/storage/images/territorio/luoghi-e-punti-di-interesse/cosa-puoi-visitare2/monte-tombea/12867-1-ita-IT/Monte-Tombea.jpg,,,,,,,
4712a201f1411ea9acbc576e756d26ab,2014-06-16T15:52:46+02:00,2014-06-16T15:53:21+02:00,"Castello di San Giovanni di Bondone","
Castel San Giovanni sovrasta il lago di Idro delle Giudicarie e fu il punto di controllo del sistema viario tra il Chiese e il GardaSulla strada che porta da Baitoni a Bondone si trova il bastione naturale su cui fu costruito il castello S. Giovanni, proprietà per secoli della potente famiglia Lodron, che dominò la valle prima di espandersi nel resto del Trentino, in Austria e in Baviera. Con il passare del tempo e a causa degli eventi il castello è decaduto ma è rimasto a testimoniare un passato glorioso.","
La prima menzione documentaria relativa al castello di San Giovanni pare risalire al 1086 quando viene citato un castrum de summo lacu. La posizione su uno sperone roccioso a picco sulle acque del Lago d’Idro suggerisce l’identificazione del castrum proprio con il castello di San Giovanni.
Posto a controllo dell’imboccatura delle Valli Giudicarie, delicata area di confine dei domini vescovili tridentini e feudo dei Lodrón, dal XIII secolo, rimase in mano alla potente casata ininterrottamente fino al Novecento, eccezion fatta per una breve occupazione da parte delle truppe milanesi del Piccinino nel XV secolo. Negli anni Cinquanta del XX secolo venne acquistato da nuovi proprietari che vi avviarono notevoli lavori di restauro.
Come per altri castelli della Valle del Chiese amministrati dai Lodrón, l’elemento militare prevale nettamente su quello abitativo-residenziale. Ne è prova che con l’avvento della polvere da sparo, si provvide ad ammodernare il complesso, trasformato in una piccola fortezza rinascimentale.
Costruito utilizzando il granito proveniente dalle lontane cave di Daone, il castello cadde in rovina per la continua spogliazione cui fu sottoposto da parte della popolazione, ansiosa di impadronirsi di pregevole materiale da costruzione. Oggi il castello di proprietà del Comune di Bondone si presenta in ottimo stato di conservazione: i recenti restauri hanno permesso di riportarne alla luce l’antica fisionomia.
COME ARRIVARE: raggiungibile solo a piedi attraverso
- la passeggiata su strada sterrata che parte dal parcheggio (15 minuti)- il sentiero che parte da Baitoni, in prossimità del parcheggio in loc. Miralago (20-30 minuti)","Località turistica",45.806312,10.550976,Bondone,,,,"http://www.visittrentino.it/it/cosa_fare/da_vedere/dettagli/dett/castello-di-san-giovanni-di-bondone|Visit Trentino",,,,
b3332821a449c5a3a79a2a3c1ab8dc3c,2014-06-17T10:56:29+02:00,2014-06-17T10:56:29+02:00,"Biosfera UNESCO","Biosfera UNESCO",,"Luogo incantevole",0,0,,/var/bondone/storage/images/territorio/luoghi-e-punti-di-interesse/cosa-puoi-visitare2/biosfera-unesco/13603-1-ita-IT/Biosfera-UNESCO.jpg,,,,,,,
