remoteId,published,modified,Titolo,"Descrizione breve",Descrizione,"Tipologia di luogo",lat,lon,address,Immagine,Comune,Tags,Fonte,Indirizzo,"Indirizzo web",Email,Telefono
2a6d72c65fc40eb698e383330fd1ca83,2014-03-26T11:43:34+01:00,2014-05-21T16:51:01+02:00,"Castel Beseno","Non v'è nessun viaggiatore che, percorrendo la Valle dell'Adige tra Trento e Rovereto, non rimanga affascinato dalla vista di Castel Beseno che con i suoi 16.000 mq di superficie è il più esteso ed imponente complesso fortificato medioevale presente in Trentino.","
Il primo nucleo fortificato risale al XII secolo, mentre l'aspetto attuale è conseguente alla profonda ristrutturazione, funzionale all'uso delle armi da fuoco, della prima metà del '500. Come gran parte dei castelli medioevali rivela una preminenza funzione difensiva sia per la posizione strategica che per la massiccia struttura con la possente cinta muraria. Nella sagoma allungata dal profilo complesso si alternano torri, spalti merlati, grandi bastioni circolari, stupendi camminamenti, mentre ad oriente si apre il maestoso campo dei tornei. All'interno si conservano frammenti affrescati di un ciclo cortese risalenti al terzo decennio del 500. Dai punti panoramici del castello si può ammirare una magnifica, quanto estesa, visione della Vallagarina e della Valle dell'Adige.Per visitare il castello:Castel Beseno è visitabile tutti i giorni esclusi i lunedì non festivi. Per informazioni 0464-834600",Castello,45.930915,11.109838,"castel beseno",/var/calliano/storage/images/territorio/da-visitare-a-calliano/castel-beseno/17853-1-ita-IT/Castel-Beseno.jpg,,,,,,,
642a2e9988ce577ac8349ee6a22af031,2014-03-26T11:45:06+01:00,2014-05-22T15:46:47+02:00,"Centro storico","
Nel centro storico la presenza di alcuni splendidi palazzi signorili dalla facciate affrescate, rendono piacevoli le passeggiate nel cuore del paese. Degne di nota sono anche la Chiesa di San Lorenzo, la Chiesetta dei Santi Sebastiano e Fabiano, nonché la piazza principale recentemente riportata al suo antico splendore.",,Percorso,45.007068,8.254988,calliano,,,,,,,,
e8bc596f23bb0403ee49c335a9dad493,2014-03-26T11:47:11+01:00,2014-05-22T15:45:09+02:00,"Percorso dell'arte","Assieme ai Comuni di Volano e Besenello e con il contributo del Comprensorio della Vallagarina nel 2006 è stato ultimato il Percorso dell'Arte con la sistemazione di numerosi sentieri.",,"Percorso naturalistico",45.007068,8.254988,calliano,,,,,,,,
fd9252b0e0b37a7694e88b37a69a5d74,2014-03-26T11:56:28+01:00,2014-05-22T15:47:41+02:00,"Cascata di Calliano","La cascata di Calliano nasce dal Rio Cavallo che parte dal biotopo di Folgaria e scende da Calliano, giungendo a sfociare nell'Adige.All'altezza del &quot;Zambel&quot; a Calliano, si arriva alla caratteristica cascata di Calliano, dove scorre acqua fresca e limpida...",,Cascate,45.007068,8.254988,calliano,,,,,,,,
63f2145d567d29dda00a543d80cdd5e9,2014-03-25T11:58:37+01:00,2015-09-07T10:57:42+02:00,"Castel Pietra, testimone dell'epica battaglia di Calliano","A oriente, sulla sommità d'una collina, Castel Beseno scruta la piana sottostante, mentre, sul confine meridionale, Castel Pietra sembra ancor oggi proteggerlo dagli invasori che per lungo tempo tentarono d'impadronirsi di questa valle.","

  







  
  







  





Come suggerisce il nome, Castel Pietra si erge su di uno spigolo di roccia nel punto ove in epoca lontanissima si assestarono i massi di una enorme frana. Un tempo una larga ansa dell'Adige lambiva le mura di Castel Pietra che era collegato fino al fiume da una massiccia muraglia merlata, di cui rimangono poche tracce, munita di una fortissima porta in ferro che aveva il compito di controllare la strada di transito.
Il suo forte nucleo centrale, con in alto la torre, risale al XII secolo e fu ampliato fino alla forma attuale nel Quattrocento con le altre parti fortificate.
Di grande fascino ed importanza sono gli affreschi della Sala del Giudizio di epoca quattrocentesca (Giudizio di Salomone, Caccia al cervo, Caccia all´orso), la torre delle impiccagioni, la sala degli armigeri e le prigioni. 
Baluardo di difesa di confine il Castello e la piana sottostante sono stati oggetto di numerose battaglie e scontri sin dal '300. Di rilievo storico sono la Battaglia di Calliano del 10 agosto 1487 e le battaglie tra truppe austriache e truppe napoleoniche di fine ‘700.
Alcuni storici e letterati ritengono che la ruina narrata da Dante nell'Inferno (XII, 4-9) sia identificabile con la grande frana sui cui sorge proprio Castel Pietra.
Il Castello, visto da lontano, quasi si confonde con la natura circostante, fatta di massi caduti dalla montagna arida e brulla ma di una suggestione unica. Il nucleo romanico stà in alto, sulla cuspide della roccia, ed avvolge la pietra che ne costituisce la colonna vertebrale.
Alla porta romanica si accede dall’alto, attraverso un sentiero tortuoso che si perde nei boschi: al’interno sono visibili gli ambienti due-trecenteschi. Le sale di soggiorno, la sala degli armigeri,le scale coi meccanismi che governano la saracinesca della porta a valle ed una lugubre cantina dove si narra che vivessero i condannati, costretti a far girare la ruota di un mulino. Gli altri ambienti legati alla roccia, più in basso, conservano anch’essi un’atmosfera misteriosa: la sala del Giudizio, con gli affreschi del ’400, il corridoio di ronda, la torre delle impiccagioni e poi, verso l’uscita al livello inferiore, la grande e comoda scala a chiocciola in pietra ed il rivellino che dà su un cortile interno, riparato da una cortina di mura appoggiata alla roccia, dove nel XVII secolo sorse il palazzo baronale, dimora più comoda ed aperta verso l’esterno.
Di grande suggestione il piccolo giardino all’italiana che ancora si conserva sul lato sud-ovest del Castello, con le viste della Valle dell’Adige, verso i luoghi dove nel 1487 si combattè la battaglia di Calliano, tra veneziani e truppe imperiali.
Si trova ad un chilometro dal paese di Calliano sulla statale del Brennero.Il Castello, dopo un complesso ed accurato restauro di quasi 2 anni (2013-14) finanziato interamente dalla proprietà, può essere visitato dal pubblico mediante visite guidate e ospitare manifestazioni, convegni e spettacoli di ogni genere.Per visitare il castello:Castel Pietra è di proprietà privata ed è possibile visitarlo previa prenotazione direttamente sul sito www.CastelPietra.info nei giorni elencati oppure per gruppi organizzati su appuntamento. Contatto: info@castelpietra.info Telefono (Famiglia Bertagnoli) 373 5039419.

  







  
  







  




  







  
   
  




",Castello,45.923057,11.093812,"Castel Pietra - Location Eventi",/var/calliano/storage/images/territorio/da-visitare-a-calliano/castel-pietra-testimone-dell-epica-battaglia-di-calliano/17166-1-ita-IT/Castel-Pietra-testimone-dell-epica-battaglia-di-Calliano.jpg,,,,,,,
2e0e460febb16b2facf785f447ead365,2014-06-04T14:13:42+02:00,2014-09-29T16:54:46+02:00,"Chiesa di San Lorenzo","In Via Valentini è possibile visitare la chiesa di San Lorenzo.e-mail calliano@parrocchietn.itwww.parrocchiecallianobesenello.it","1. CENNI STORICI: Le tre chiese
1.1 La Battaglia di Calliano Nell’anno 1487 il territorio Lagarino fu il campo di battaglia per le truppe del Principato Vescovile di Trento e l’esercito della Repubblica di Venezia; il Conte del Tirolo (Impero d’Austria) l’Arciduca Sigismondo ed il suo esercito si affiancarono alle truppe trentine per fermare il potere veneziano, guidato da Roberto di Sanseverino, che si stava sempre più espandendo dal mare fino alle Alpi e intento a conquistare anche le terre del Tirolo. I due eserciti si scontarono nella nostra piana, facendo rimanere nella storia l’evento come la Battaglia di Calliano: il valoroso condottiero Roberto di Sanseverino morì e ciò ne conseguì la resa e sconfitta dei Veneziani verso i Tirolesi.
Era il 10 agosto 1487, festa di S.Lorenzo. Sigismondo del Tirolo fece voto a questo Santo di erigere una Cappella in suo onore come ringraziamento e per raccogliere degnamente in un cimitero lì accanto, le salme dei caduti.
1.2 La prima chiesetta – 1492 ca.
 Nel 1492, presumibilmente, venne eretta la cappella votiva di S.Lorenzo, della quale non esiste alcun progetto o documento, se non uno schizzo fortunatamente ritrovato nel Museum Ferdinandeum di Innsbruck e pubblicato dal Dr. Oswald Trapp nel 1965. Dal disegno si leggono alcune frasi di spiegazione, la piccola chiesetta vista lateralmente con, sulla faccia principale, un dipinto a muro del martirio di S.Lorenzo ed in posizione opposta una piccola torretta con due campane.
1.3 La seconda chiesa – fine 1500-inizio 1600  Nella visita pastorale del 1580, si presenta già a Calliano la costruzione della seconda chiesa, o meglio dell’ampliamento e radicale modifica della piccola cappella originale. Con molta probabilità e quasi certezza, fu la Famiglia dei Conti Martini a realizzare l’opera di ampliamento della chiesetta ed in seguito saranno sempre loro a rispondere alle necessità ed agli acquisti per la nuova chiesa.Nel 1580 la Chiesa cambia la direzione, volgendosi ad Ovest-Est e portando l’entrata principale dove si trova attualmente. Sono realizzati già tre altari:


dedicato a S.Lorenzo, posto in cima alla chiesa, che terminava più o meno dove erano le mura laterali della prima;

dedicato a S.Agata, patrona e titolare della Parrocchia di Besenello, a cui Calliano apparteneva;

dedicato a S.Caterina.


1.4 La terza chiesa e attuale – 1724Da un documento di compravendita di un terreno, antistante la chiesa, del 1723, si parte con l’ampliamento del luogo di culto, ormai piccolo ed inadatto alle esigenze. Si costruisce la maestosa cupola attuale, dirigendosi quindi sempre più a est ed innalzando anche il tetto con la volta.Più ampia e sufficiente, la chiesa prende un aspetto diverso, anche grazie al maggior respiro dato dalla cupola e dalle ali dove vengono collocati i due altari, dell’Addolorata e di S. Barbara prima, S.Caterina poi.
L’Altare Maggiore dapprima in legno, viene poi realizzato in stucco duro e poi rivestito di marmo. Le statue, realizzate dallo scultore Antonio Spagnolli di Reviano d’Isera, rappresentano:
 partendo da sinistra S.Pietro, con le chiavi del paradiso, S.Giuseppe e Sant’Antonio e all’estrema destra S.Paolo con la spada. Dietro l’altar maggiore, prende posto la Pala di S.Lorenzo e la Battaglia, anno e autore ignoti.Nell’anno 1994, grazie ad alcuni lavori di restauro e sistemazione dei muri, viene riportato alla luce, e tuttora visibile, l’antico portale del 1492 che portava dalla chiesa alla sagrestia, allora posizionata alla base del campanile, che fu murato a seguito dei lavori di ampliamento del 1724.",Chiesa,45.93473,11.09421,"Via Valentini, 15 - 38060 Calliano ",/var/calliano/storage/images/territorio/da-visitare-a-calliano/chiesa-di-san-lorenzo/21304-1-ita-IT/Chiesa-di-San-Lorenzo.jpg,,,,,,,
d0f818779de3643dd6226053f63aa3f6,2018-12-18T16:33:12+01:00,2018-12-28T11:36:46+01:00,"Arminio de Valentini","La scultura è un chiaro ed inequivocabile omaggio ad Arminio De Valentini, benefattore della collettività tutta di Calliano e del suo comune . Si tratta di un mezzobusto superiore raffigurante volto e spalle di De Valentini, con particolari quasi reli di baffi ed espressione vivida . La scultura è posata su piedistallo di marmo di circa 150x50cm. Scultura in bronzo su marmo.AUTORE : SCONOSCUTOANNO : NON NOTOTITOLO OPERA : ARMINIO VALENTINITECNICA E MATERIALI : SCULTURA IN BRONZO SU MARMO",,,45.93585,11.094742,"Municipio di Calliano, Via Arminio Valentini, Calliano, Comunit&agrave; della Vallagarina, TN, Trentino-Alto Adige, 38060, Italia",/var/calliano/storage/images/territorio/il-paese-di-calliano/opere-d-arte-del-comune/arminio-de-valentini/85363-1-ita-IT/Arminio-de-Valentini.jpg,,,,,,,
