remoteId,published,modified,Titolo,"Descrizione breve",Descrizione,"Tipologia di luogo",lat,lon,address,Immagine,Comune,Tags,Fonte,Indirizzo,"Indirizzo web",Email,Telefono,"Galleria immagini"
7ad5e86879ca4c1956fc8f909102ffc6,2015-12-02T11:29:19+01:00,2015-12-14T10:04:25+01:00,"Antica Fusina Zanghellini","Nell'abitato di Agnedo, in Via dei Molini, vi è l'Antica Fusina Zanghellini.","Già poco dopo la chiusura dell’attività paterna i locali della fusina sono stati trasformati dal proprietario in una esposizione permanente di strumenti di lavoro e dei principali utensili prodotti dall’antica manifattura che, dall’anno 2000, dispone anche di un coinciso memorandum riportante brevi notizie e ricordi orali tramandati di generazione in generazione.l'esposizione permanente, acura della famibglia Zanghellini, di strumenti di lavoro e dei principali utensili prodotti dall'antica manifattura.Pubblicazioni: L'antica fusina Zanghellini nella villa d'Agnedo (Franco Gioppi Massimo LIbardi)L'Officina Zanghellini è inserita nella rete di nusei diffusi &quot;etnografici&quot; gestita dal Museo di San Michele all'Adige (apre il link in una nuova finestra)  ",,0,0,,/var/castelivano/storage/images/territorio/cosa-visitare/a-villa-agnedo/antica-fusina-zanghellini/19480-2-ita-IT/Antica-Fusina-Zanghellini.jpg,,,,,,,,
e26880fb2797e689828dc42411c9b23a,2015-12-14T09:55:20+01:00,2015-12-14T09:55:20+01:00,"La Via Claudia Augusta","La Claudia Augusta Altinate fu una delle piu' importanti strade militare della X regio, iniziata da Druso nel 15 a.C. e terminata dall'imperatore Claudio, suo figlio, nel 47 d.C.: il ruolo di collegamento che svolgeva questa strada, doveva rappresentare sia dal punto di vista militare sia da quello economico il peso che l'area delle tre venezie sosteneva in quanto, partendo da Altino (in provincia di Venezia), porto della laguna veneta, al centro delle rotte tra Ravenna e Aquileia, la Claudia Augusta si snodava attraverso le valli alpine fino alla Rezia e di qui al Danubio (ab Altino usque ad flumen Danavium, come riportato nell'iscrizione incisa sul miliario di Cesiomaggiore (nella provincia di Belluno)). La via si trova a fare da direttrice portante ai collegamenti della zona della X regio, &quot;dopo che le Alpi erano state aperte con la guerra&quot;, da cui si capisce la sua notevole importanza militare. Ma qual'era il percorso della Claudia AugustaAltinate?","Il percorso della Caludia Augusta Altinate e' stato ricostruito dagli storici grazie a ricerche effettuate direttamente sul territorio, analizzando le tracce lasciate in diverse zone del triveneto. Anche grazie ad alcune scoperte archeologiche, come ad esempio il &quot;cippo&quot; rinvenuto a Cesiomaggiore (nella provincia di Belluno), o un altro miliario scoperto nei dintorni di Rabla' (vicino a Merano (in provincia di Bolzano)), si sono potute determinare le caratteristiche del percorso cge viene riportato in figura. Da Altino (in provincia di Venezia), quindi, la via portava al feltrino per poi attraversare la Valsugana fino a Trento; da qui seguendo la valle dell'Adige la Claudia Augusta varcava l'odierno confine presso Merano (nella provincia di Bolzano) per raggiungere infine il Danubio. Per analizzare meglio l'effettivo andamento che aveva la Claudia Augusta Altinate è opportuno dividere il percorso in tre parti: la prima fino a Feltre (in provincia di Belluno); la seconda si snoda lungo il tratto alpino che la Claudia Augusta Altinate seguiva; mentre la terza arriva fino al Danubio
Come abbiamo detto, la Claudia Augusta Altinate collegava l'Adriatico con il Danubio, partendo dal porto di Altino. Ancora oggi si discute sul percorso che la strada avrebbe dovuto seguire in alcuni punti che, nonostante le ipotesi di alcuni storici, rimangano ancora incerti. Tuttavia si e' sostanzialmente d'accordo su diverse zone &quot;fisse&quot; toccate dalla via militare, quali la zona del feltrino, la Valsugana, Trento, la valle dell'Adige, Merano ed infine il Danubio a Maia, luogo in cui la strada ha termine. Partendo da Altino, quindi, che e' ormai ufficialmente riconosciuto come luogo principale dal quale parte tutto il sistema viario del nord-est, possiamo pensare di percorrere noi stessi la strada cercando di capire il tragitto che le legioni romane seguivano per raggiunge le Alpi: lasciato il centro portuale la via proseguiva con un rettilineo diretto verso nord, seguendo il quale incontrava presso l'odierno comune di Carbonera (in provincia di Treviso) la via Postumia, diretta da est a ovest verso Aquileia (in provincia di Udine), attraversando cosi' la pianura trevigiana. Probabilmente poco piu' ad est di Nervesa della Battaglia (in provincia di Treviso) la Claudia Augusta attraversava il Piave per raggiungere il feltrino e le zone alpine. Al giorno d'oggi non si ha ancora l'assoluta certezza di quale fosse l'effettivo percorso della Claudia Augusta per raggiungere la zona del feltrino dato che esistono diverse tesi, nessuna delle quali pero' ha prevalenza sulle altre. Probabilmente una volta giunta a Valdobiadene (in provincia di Treviso) la strada avrebbe continuato il suo percorso mantenendosi sulla sponda sinistra del Piave fino ad attraversare nuovamente il fiume presso Busche (in provincia di Belluno), da dove avrebbe raggiunto la citta' di Feltre (in provincia di Belluno) passando per Cesiomaggiore (in provincia di Belluno). Tuttavia altre ipotesi avanzate da studiosi come il De Bon attestano il passaggio della via attraverso la stretta di Quero (in provincia di Belluno), dopo aver ripassato il Piave da Vidor (in provincia di Treviso); altri ancora come il Bellis e Alpago Novello parlano di un proseguimento lungo il corso del Soligo che avrebbe portato la Claudia Augusta a superare il passo di Praderadego o quello di San Boldo (entrambi i passi sono in provincia di Belluno) per poi raggiungere Feltre scendendo lungol a val Belluna. Secondo lo stesso De Bon, pero', la via una volta raggiunta Feltre, proseguiva in direzione delle sorgenti del Piave percorrendo la val Pusteria e la valle dell'Isarco fino al Brennero (in provincia di Bolzano): escludeva, quindi, che la strada documentata dal cippo di Rabla' (vicino a Merano (in provincia di Bolzano)) fosse proprio la Claudia Augusta Altinate, ma che, invece, dovesse trattarsi di una seconda via denominata Claudia Augusta Padana, che molti storici invece ipotizzano passi attraverso la valle dell'Adige per collegare Verona con Trento e le Alpi retiche. Pur non essendo tutte convincenti le varie ipotesi, alcune delle quali risultano anche contrastanti tra loro, sta di fatto che il feltrino assume un'importanza rilevante svolgendo il ruolo di passaggio obbligato per il collegamento tra l'Adriatico e i passi alpini, documentato nel miliario rinvenuto nei pressi di Cesiomaggiore, il quale rappresenta una forte carica celebrativa nei confronti dell'imperatore ma anche dell'intero esercito romano.
Intendiamo con il termine &quot;tratto alpino&quot; il percorso seguito dalla via all'interno del Municipio di Feltre, anticamente Feltria, il quale comprendeva parte della Valsugana fino al torrente Sila presso Pergine (in provincia di Trento), la conca feltrina, il territorio di Lentiai (in provincia di Belluno), il bacino del Cismon fino alla confluenza con il Brenta. Analizzando questo tratto ci troviamo di fronte a due maggiori ipotesi tra le tante avanzate: la prima identifica con la Claudia Augusta la strada che raggiungeva Feltre e proseguiva toccando Arten (in provincia di Belluno), Castel Tesino, Borgo Valsugana (entrambi in provincia di Trento), Trento, Merano (in provincia di Bolzano), ecc. La seconda, invece, espone che la via da Praderadego (in provincia di Belluno) passava a nord di Feltre nei pressi di Sovramonte (in provincia di Belluno). Ritornando al dubbio aperto dal De Bon, probabilmente il tratto che da Feltre conduceva alla val Pusteria attraverso il Cadore costituiva la primitiva Claudia Augusta, poi spostava verso Trento in anni successivi. Quanto al feltrino, l'ipotesi piu' attendibile resta quella dell'Alpago Novello che cita dopo Cesiomaggiore la val Canzoi, Arson, Lasen, Aune, Lamon (tutti in provincia di Belluno), come centri abitati attuali toccati dall'antica strada; altri sostengono che la via giungesse a Pedavena (in provincia di Belluno) dirigendosi verso Arten e poi Castel Tesino, sulla base di una strada documentata nel Canaletto, ma probabilmente successiva. Volendo dare ragione all'Alpago Novello, il cui lavoro sembra essere stato il piu' attento ai particolari, tenendo conto che si trattava principalmente di una via militare, dobbiamo tornare al passo di Praderadego: queste erano le prime montagne che si presentavano a chi percorreva questa strada, dopo un tratto in pianura abbastanza agevole. Una torre costruita sul luogo indicava la via, come quella nei pressi del piu' tardo castello di Zumelle (in provincia di Belluno), dalla quale si raggiungeva il Piave che veniva attraversato per mezzo di un ponte di barche, in localita' Nave (anch'esso in provincia di Belluno), per raggiungere Cesiomaggiore. Prima di giungere ad Aune si doveva attraversare i torrenti Caorame e Stien, poi passare per Servo (in provincia di Belluno) da cui scendendo e subito risalendo la valle si arrivava a Lamon (e' ancora presente un ponte detto romano). Molto interessante e' il tratto da Lamon a San Donato, che si puo' scorgere da Arina, parallelo alla strada attuale. Un altro ponte romano si trova a Castel Tesino, dopo il paese di San Donato. Il percorso nel tratto alpino di Feltre si conclude infine, con la discesa verso Pergine della Claudia Augusta, la quale proseguira' il suo percorso attraverso la Valsugana. Una volta lasciata la zona del feltrino e arrivati a Trento, seguendo il corso dell'Adige arriviamo fino a Merano (in provincia di Bolzano). Dalle Alpi Sarentine ci dirigiamo verso le Alpi Retiche e valichiamo il Passo di Resia (sul confine italo-austriaco) e proseguendo verso nord arriviamo a passare tra le citta' Austriache di Prutz e Stuben. Di qui v'è un altro dubbio su quale fosse il vero percorso seguito dalla Claudia Augusta. Le due tesi, nessuna delle quali pero' ha conferma, sono divergenti: la prima afferma che la strada prosegua verso est passando per Prutz, mentre la seconda ne sostiene il transito ad ovest attraverso la citta' di Serfaus. Di qui si prosegue sempre verso nord con un andamento anche tortuoso e in alcuni tratti pericoloso, visto la zona montuosa ove si e'. Si passa poi per la citta' di Starkenbach e di seguito per Imst. Continuando sempre verso nord passiamo a pochi chilometri a est la citta' di Bichlbach e ugualmente facciamo ancora piu' a nord con la citta' di Füssen. Attraversiamo poi il centro cittadino di Altenstadt e successivamente quello di Eofach. Continuando ancora sorge un'altra divergenza d'opinioni su quale fosse il reale percorso dell'antica via. Dopo aver passato Landsberg v'è un dubbio sul fatto che la strada proseguisse con un andamento pressoche' rettilineo puntando direttamente verso nord oppure se avesse una deviazione verso ovest per la citta' di Igting: quale fosse realmente il tracciato non e' ancora stato accertato. Quale fosse il reale percorso, sebbene non sia accertato, ci consente ugualmente di ripercorre ancora l'antico tracciato che per certo passava per Königabrunn e poi si raggiunge Amburgo. Di qui si passa poi per Meltingen e successivamente per Druisheim. A questo punto mancano pochi chilometri da percorrere per giungere a Donauwörth che è il punto in cui la Claudia Augusta Altinate ha termine dato che ha raggiunto il Danubio.
Per approfondire:
www.claudia-augusta.net (apre il link in una nuova finestra) (apre il link in una nuova finestra) (apre il link in una nuova finestra)  www.viaclaudia.org (apre il link in una nuova finestra) (apre il link in una nuova finestra) (apre il link in una nuova finestra)  ","Via o piazza",0,0,,/var/castelivano/storage/images/territorio/cosa-visitare/a-spera/la-via-claudia-augusta/20501-1-ita-IT/La-Via-Claudia-Augusta.jpg,,,,,,,,
d5c39680487115e45ff170d6235e545c,2015-12-14T09:56:48+01:00,2015-12-14T09:56:48+01:00,"La strada del castagno","Il percorso nasce per volontà di dieci amministrazioni comunali dislocate alle pendici del Lagorai nella Valsugana orientale e caratterizzate da una comune ricchezza paesaggistico-ambientale costituita dalla presenza del castagno come specie caratteristica del proprio territorio e fin qui mantenuta con orgoglio e notevole sforzo dai loro abitanti.","
Le castagne di Spera
Per molto tempo il castagno è stato considerato una pianta non originaria della regione europea; tuttavia le ultimissime analisi su reperti pollinici postglaciali rinvenuti in Italia hanno confermato l’esatto contrario. La castanicoltura in Europa e in Italia in particolare ha avuto notevole impulso con l’epoca romana; il castagno aveva infatti una duplice importanza: da un lato contribuire a sfamare le persone delle aree più povere nei mesi invernali, dall’altro si ricavava la paleria per le colture agricole. Durante il Medioevo l’importanza del castagno aumentò ancora grazie all’azione dei monaci che selezionarono le varietà più produttive. Nel secolo scorso l’utilizzo era massiccio a partire dai frutti fino al legno; quest’ultimo utilizzato per la costruzione di mobili e travature oltrechè per paleria di diverse dimensioni.Progressivamente il castagno iniziò a subire notevoli attacchi sia per il graduale incremento nell’utilizzo del legno usato per ricavare carbone e tannino da destinare alle nascenti industrie, che per problemi di natura fitopatologia con l’affermarsi di alcune gravi malattie di origine fungina come il “Mal dell’inchiostro” (Phitophtora Cambivora) e il “Cancro corticale” (Endothia Parasitica) che hanno continuato a produrre grossi danni fino ai giorni nostri. Attualmente la coltivazione sta ritornando ad avere una certa convenienza economica per la sempre maggiore richiesta di castagne di qualità che riescono a spuntare un buon prezzo di vendita sul mercato. Alcuni produttori propongono anche nuovi prodotti lavorati come le castagne sotto grappa o le creme.
La Strada del Castagno
Il percorso nasce per volontà di dieci amministrazioni comunali dislocate alle pendici del Lagorai nella Valsugana orientale e caratterizzate da una comune ricchezza paesaggistico-ambientale costituita dalla presenza del castagno come specie caratteristica del proprio territorio e fin qui mantenuta con orgoglio e notevole sforzo dai loro abitanti. 
La strada del castagno cerca di coniugare due aspetti fondamentali per il territorio: da un lato rilanciare l’immagine di naturalità, bellezza paesaggistica e tutela del territorio e dall’altro favorire il recupero delle aree castanicole e agricole abbandonate o scarsamente sfruttate in modo da creare le condizioni per continuare nel tempo il mantenimento sul territorio di questa produzione.Circuiti di diversa durata e difficoltà collegano i diversi territori proponendo per ogni zona un percorso alla scoperta delle specificità locali (storia, cultura, ambiente, attività e prodotti tipici).
I percorsi nel nostro territorioLungo l’antica via Claudia Augusta - Scurelle c/o area di sosta (410 m) – Fraz. Paoli (423 m) - – Loc. Castellare (460 m) – Spera ( 550 m). L’itinerario collega i paesi di Carzano e Spera attraversando il territorio di Scurelle nella zona detta “de le Castellare”, area archeologicamente molto interessante e che secondo lo studioso Arpago Novello era attraversata dall’antica Via romana Claudia Augusta oltrechè luogo di insediamento dell’antico Castello di Nerva.Tra i castagni del Col Fatero - Spera c/o Chiesa (560 m) – Col Fatero (600 m) – Loc. Fontanelle (671 m) - Loc. Torgheli (647 m) Paterni (570 m). Si consiglia la partenza nei pressi della chiesa parrocchiale per poi proseguire in direzione del Col Fatero. Il percorso sale imboccando una comoda stradina di campagna che incrocia in località Paterni la chiesetta di Santa Apollonia e ci conduce all’incrocio con la strada principale che collega Spera alla località Fontanelle dove campi e boschi di castagni secolari si alternano lungo tutto il tragitto. Si tramanda che le dolci castagne di questa zona fossero apprezzate addirittura dall’imperatore Francesco Giuseppe. Da quest’ultima località si prende una strada poco trafficata per il rientro in paese.Tra chiese e castagni - Samone c/o Punto informativo (710 m) – Loc. Cristo d’Oro (827 m) – Loc. Paluati (770 m) – Punto informativo (710 m). Il percorso è un po’ impegnativo soprattutto nella parte iniziale dove dal paese si arriva alla località Cristo d’Oro; proseguendo, di li a poco, si incrocia il monumento ai caduti di tutte le Guerre. Qui si devia a sinistra imboccando una strada sterrata in mezzo al bosco; dopo qualche centinaia di metri si incrocia il collegamento che scende a Spera mentre proseguendo lungo la strada la vegetazione si fa sempre più rada. Appena rientrati in paese si incrocia il “Capitello ai Trisotti”, eretto in onore di S. Rocco e della Madonna della Concenzione. Proseguendo si incrocia la Chiesa Parrocchiale. Nei pressi della Chiesa si incrocia un altro collegamento con il paese di Spera che transita nella parte bassa dell’abitato.Da Strigno a Samone per antiche strade - Strigno c/o cimitero (460 m) – Fraz. Tomaselli (572 m) – Fraz. Latini (646 m) – Samone (670 m) e ritorno. Punto di partenza del percorso è il paese di Strigno. Il percorso prosegue in direzione della valle del Chieppena incrociando appena fuori paese il cimitero con la chiesa di S. Maria di Loreto. Proseguendo si prende una comoda strada di campagna che si inerpica verso la frazione di Tomaselli. Il percorso prosegue sempre in leggera salita passando per la frazione di Latini; tra campi coltivati e boschi lungo sentieri e strade interpoderali si arriva a Samone meta finale dell’itinerario.
Per approfondireLa strada del castagno (apre il link in una nuova finestra) (apre il link in una nuova finestra) (apre il link in una nuova finestra)  ",,0,0,,/var/castelivano/storage/images/territorio/cosa-visitare/a-spera/la-strada-del-castagno/20515-1-ita-IT/La-strada-del-castagno.jpg,,,,,,,,
62e1e864636f746c64b9104be308a870,2015-12-14T09:57:41+01:00,2015-12-14T09:57:41+01:00,"Il capitello di Via Strigno","Nel 1917 c’era, e tuttavia c’è ancora, a lato della strada che collega Strigno a Spera, una cappelletta del tutto simile a quelle che, nel segno della devozione, costellano soprattutto gli incroci dei sentieri tracciati fra i campi.","
Domina l’abitato di Carzano e buona parte della conca intorno a Borgo e, sul finire dell’estate di quell’anno di guerra, quella piccola costruzione con i muri segnati dalle schegge e dalle raffiche della mitraglia si trovava nella “terra di nessuno”, cioè fra la massa dei reticolati stesi davanti alle trinceee dai soldati del Regio Esercito e quelli messi a protezione delle postazioni austriache.
E’ lì che il maggiore Cesare Pettorelli Lalatta del servizio informazioni incontra il comandante interinale del V° battaglione bosniaco che si dichiara irredentista e vive il dramma di coscienza di migliaia di soldati che combattevano sotto le insegne dell’Impero ma, appartenendo a ceppi linguistici e culturali diversi da quello austriaco, volevano l’indipendenza da Vienna.
Ljudevit Pivko, sloveno e in pieno accordo con ufficiali e sottufficiali cechi, voleva consegnare all’esercito italiano il battaglione di soldati bosniaci che presidiava le macerie di Carzano.
Pivko aveva compreso che quella zona della Valsugana era ideale per dare un durissimo colpo alla monarchia danubiana creando con una grave sconfitta militare i presupposti per garantire l’indipendenza a i popoli decisi a staccarsi dall’Austria.
Attraverso quella falla gli italiani potevano forse raggiungere Trento e far crollare tutto il fronte del Tirolo ben prima che arrivassero i tragici giorni di Caporetto.
Di notte al riparo di quella cappelletta, i due ufficiali, divenuti da nemici alleati, gettarono le basi di quello che fu il Sogno di Carzano.Mai, su nessun fronte della Grande Guerra, un esercito si trovò davanti ad un’occasione tanto straordinaria, ad un passo da una vittoria che, forse, poteva essere decisiva.",,0,0,,,,,,,,,,
