remoteId,published,modified,Titolo,"Descrizione breve",Descrizione,"Tipologia di luogo",lat,lon,address,Immagine,Comune,Tags,Fonte,Indirizzo,"Indirizzo web",Email,Telefono,"Galleria immagini"
50dde48d97088972afbce3cdcac161ce,2015-12-14T09:58:53+01:00,2015-12-14T09:58:53+01:00,"Il Capitello di Nane Ciopa","
&quot;Semplice come un fanciullo, mite come gli animali che guidava al pascolo, fu colpito gravemente da un fulmine in questo luogo il 09 luglio 1957.
Trasportato a valle dagli operai della cava di quarzo del Monte Cima, morì all'ospedale di Borgo il 15 luglio 1957.
Martino Giovanni Purin &quot;Nane Ciopa&quot; da Spera (1883 - 1957).
Dopo quasi 50 anni un gruppo di amici lo ricorda ancora a dedica questo cippo a lui e a quanti vissero e lavorarono fra questi monti.Valcava - Monte Tauro 15 luglio 2005&quot;.","
Alla presenza di 200 - 250 persone provenienti da tutta la valle, la cerimonia officiata da Don Mario Tomaselli è iniziata col canto di &quot;Amici Miei&quot; da parte dei bambini della Colonia di Primalunetta. Dopo una breve cronistoria da parte di Don Mario, c'è stata la benedizione del capitello davanti al quale è stata posta una targa in legno di larice con incisa la seguente dicitura:
Semplice come un fanciullo, mite come gli animali che guidava al pascolo, fu colpito gravemente da un fulmine in questo luogo il 09 luglio 1957.
Trasportato a valle dagli operai della cava di quarzo del Monte Cima, morì all'ospedale di Borgo il 15 luglio 1957.
Martino Giovanni Purin &quot;Nane Ciopa&quot; da Spera (1883 - 1957).
Dopo quasi 50 anni un gruppo di amici lo ricorda ancora a dedica questo cippo a lui e a quanti vissero e lavorarono fra questi monti.Valcava - Monte Tauro 15 luglio 2005.
Dopo la cerimonia tutti alla Colonia Primalunetta per la celebrazione della S. Messa dedicata alla memoria di Nane Ciopa, e a seguire una bicchierata e un ricco spuntino offerto dai parenti.Riportiamo di seguito il discorso letto dal Maestro Tullio Degiorgio e segnalato a mezzo Radio Squadra in data 13.03.1958:
Il giorno nove luglio millenovecentocinquantasette, in località PRIMALUNA – MONTE CIMA – MONTE TAURO nel settore delle Alpi a nord della VALSUGANA Centrale, verso le ore 16, imperversava un violento temporale.
Il pastore MARTINO PURIN fu Giuseppe da Spera, nato 74 anni or sono, coadiuvato dal pastorello DECIMO PURIN di Adone, di anni 7, cercava di raccogliere in gruppo alcune mucche che stavano pascolando sui prati di montagna, nella località sopra indicata.
Il temporale intanto assumeva una violenza inaudita: lampi e tuoni si susseguivano ininterrottamente e dal cielo minaccioso scrosciava la pioggia a rovesci. Ad un tratto un bagliore improvviso ed accecante, con un tuono terribile. Il bambino corre al riparo presso un sasso, mentre un fulmine si abbatte proprio addosso al gruppo di armente vicine al vecchio pastore.
Il fuoco prende di striscio il vecchietto e lo fa rotolare sul terreno in pendio, mentre sei giovenche cadono fulminate sul posto: le altre 17 bestie scappano impaurite per un sentiero. Il ragazzetto, vede il vecchio pastore con le vesti in fiamme e tutto rannicchiato per la scossa; in tanto frangente il piccolo DECIMO non si perde d’animo; corre alla lontana cascina della malga e con tutta forza chiama al soccorso. Accorre tosto il capo malga Costa Cesare, assieme al pastore Purin Giuseppe: guidati dal piccolo, giungono tutti trafelati al luogo del disastro dove il fulminato era caduto. Mentre il capo malga e l’altro pastore cercavano di trascinare in alto il fulminato, che presentava delle forti bruciature lungo il collo ed il tronco, il piccolo Decimo correva alla teleferica di Monte Cima; presso quella stazione di arrivo doveva esserci qualche operaio. Infatti questi vennero immediatamente sul posto della disgrazia, dove con una portantina rudimentale, poterono avviare, con abbastanza rapidità, il ferito allo ospedale di Borgo. In un primo tempo sembrava di poter salvare il fulminato, che ricordava in tutti i suoi particolari l’avventura occorsagli.
Alla fine della settimana di degenza però, forse per un improvviso, quanto temuto collasso, il povero infortunato cessava di vivere. Al funerale, svoltosi qui a Spera in forma solenne, partecipò gran folla; non mancavano i soccorritori del defunto, e tra essi il piccolo DECIMO PURIN.
Le scuole di Spera sono fiere di annoverare fra i suoi alunni il ragazzetto che partecipò così animosamente alla avventura.Spera, nello ottobre 1957.",,0,0,,/var/castelivano/storage/images/territorio/cosa-visitare/a-spera/il-capitello-di-nane-ciopa/20543-1-ita-IT/Il-Capitello-di-Nane-Ciopa.jpg,,,,,,,,
87fc40e8a24aadf9f45b87b4b722b200,2015-12-14T09:59:32+01:00,2015-12-14T09:59:32+01:00,"Il Capitello a ricordo dei nostri ""Veci""","L’idea di creare un angolo un po’ appartato, un po’ mistico, per ricordare quelli che non ci sono più, è nata nella testa di Luigi Borsato, farmacista di Strigno, già qualche anno fa da quando, durante un suo viaggio in Romania, scovò, chissà come, un vecchio artistico crocefisso.","
Domenica 4 settembre 2011 in Primalunetta, in occasione della tradizionale festa del Coro S. Apollonia, è stato inaugurato, con la benedizione impartita da Don Armando, il “Capitelo a ricordo dei Nostri Veci”.
L’idea di creare un angolo un po’ appartato, un po’ mistico, per ricordare quelli che non ci sono più, è nata nella testa di Luigi Borsato, farmacista di Strigno, già qualche anno fa da quando, durante un suo viaggio in Romania, scovò, chissà come, un vecchio artistico crocefisso.
Prima la recinzione, poi la fontana di legno (albio) che raccoglie l’acqua della “Val del Vesco” e finalmente il massiccio tronco di larice che protegge la grande croce dalle intemperie.
La “bora” era stata scartata in segheria, perché da un controllo con il “metal-detector” risultava contenere una massa metallica (probabilmente una scheggi adi bomba della Prima Guerra Mondiale).
Acquistata a prezzo stracciato, Bruno Purin ha rischiato la motosega ma gli è andata bene: la presunta scheggia è ancora custodita all’interno del tronco protetta dal legno, dai pini sovrastanti e dalle grandi braccia del Cristo Crocefisso che tutti chiama a raccolta.
La panchina – dono di Gregorio Paterno – posta in sostituzione di un’altra un po’ più rudimentale, ma tanto cara a Bano Banela, consentirà a chi passa di rifiatare e nello stesso tempo di dedicare un pensiero a coloro che tra queste montagne hanno lavorato e sofferto (strusià) per strappare a questa terra, così povera e così arida, un po’ d’erba per gli animali, un po’ di legna per scaldare le case, per migliorare le precarie condizioni di vita delle loro famiglie di tanti anni fa.
I nostri veci … Vorrei ricordare qualche nome: i Bepate, i Lugarini, i Fulgi, i Banele, Arturo e Arminio de Modesto, Zeleste e Ele de Bepo, Cesare e Livio de Ico, Toni e Dolfo del Bianco, Angelo e Mano de Pipo, Giuseppe de Loli, Nane Ciopa, Gino de Cianci … e ancora l’ingegner Mario e la siora Maria, don Gioacchino Ferrari e tanti altri …
“I nostri Veci” che hanno scritto la pur umile storia del nostro paese e che ora riposano nel cimitero di Spera, avranno qualcuno in più che dedica loro un ricordo, una preghiera …Quest’opera realizzata e posta in opera da un gruppetto di “nuovi” pensionati si trova quasi al temine dell’antico “Trodo dei Salti”, che in circa tre ore di cammino portava da Spera a malga Primalunetta ed è stata donata al Comune di Spera, anzi, alla Comunità di Spera.
Sullo schienale della panca si trovano incise queste parole:
Sul trodo dei salti in Primaluna
ghe ‘n gran crocefisso su na bora
coi brazi verti che ‘l ne ciama a una.
E na lagrima a mi me scapa fora
ogni volta che paso: a pensar
ai nostri veci, che su par ste montagne
i e’ vegnesti a viver e strusiarpar combater la fame e le magagne.Decimo Purin",,0,0,,/var/castelivano/storage/images/territorio/cosa-visitare/a-spera/il-capitello-a-ricordo-dei-nostri-veci/20557-1-ita-IT/Il-Capitello-a-ricordo-dei-nostri-Veci.jpg,,,,,,,,
4609e5c114309f7d586891562b60ee53,2015-12-14T10:00:21+01:00,2015-12-14T10:00:21+01:00,"Croz de Primalunetta","Il massiccio di forma approssimativamente trapezoidale, la cui estremità nord-ovest è costituita dal monte Cenon (q. 2283 IGM) mentre il cosiddetto Croz di Primalunetta (m. 2304 IGM) ne forma l’estrema cresta sud-est.","
All’inizio del conflitto non rientrava tra le posizioni prescelte dalle forze austroungariche per opporsi agli italiani lungo il crinale del Lagorai. Tutto il massiccio di Cima d’Asta, con i sottogruppi di Tovà e di Rava (del quale ultimo Cenon e Primalunetta fanno parte) era infatti in posizione troppo avanzata per poter essere difeso dalle scarse truppe di cui l’esercito degli Asburgo all’epoca disponeva.
Nell’estate del 1915 il massiccio era quindi meta di pattuglie dei due eserciti, senza che alcuno vi si insediasse stabilmente, fino alla metà di agosto, quando, nell’ambito dell’occupazione italiana delle cime di Rava, anche questa posizione, occupata dalla brigata Venezia, entrò a far parte dello schieramento avanzato delle regie truppe. Ma già tra settembre ed ottobre di quell’anno la linea italiana avanzò ad est del torrente Maso e la montagna passò in retrovia, senza venire occupata che da pochi osservatori d’artiglieria.
Con il progredire, nel maggio del 1916, dell’offensiva austriaca degli altipiani, anche in Valsugana si verificò un consistente ripiegamento delle forze italiane, che obbligò le forze dislocate in Val Calamento a ritirarsi ad est del Maso. Cima Primalunetta, il 24 maggio 1916, venne occupata da una compagnia del battaglione alpini Intra ivi ripiegata da Val Fregio, che però a causa di un malinteso l’abbandonò per poche ore, il giorno 25, senza attendere il cambio da altro reparto. Quella stessa sera pattuglie austriache salirono a monte Cenon e raggiunsero poi il Croz di Primalunetta senza incontrare resistenza e vi si insediarono. Da quel momento il massiccio divenne una vera spina nel fianco per le posizioni italiane del Tombolin di Caldenave, di Forcella. Ravetta e del monte Cima: dalla q. 2304 del Croz di Primalunetta quelle posizioni erano infatti in piena vista ed esposte al tiro di mitragliatrici e cannoncini che prontamente gli austriaci avevano trasportato lassù. La guarnigione austriaca, truppe del 164 battaglione Landsturm, Standschützen di Merano e Vipiteno e Kaiserjäger della 3ª Streifkompanie, occupava la vetta solamente con le truppe di prima linea, mentre le riserve erano ammassate negli angusti baraccamenti del cosiddetto “villaggio austriaco”, posto nell’avvallamento settentrionale,defilato alla vista italiana, sopra all’Aia Patissi.
Per rioccupare la posizione gli alpini del battaglione Morosa attaccarono da malga Primaluna il 10 giugno 1916, ma senza successo e con alcuni morti. Stesso esito ebbe l’attacco notturno del battaglione alpini Monte Pavone il successivo giorno 16, quando gli italiani attaccarono lungo i ripidissimi pendii prativi occidentali.
La riconquista della montagna avvenne il 3 luglio 1916, grazie ad un attacco svolto dal plotone esploratori del battaglione Monrosa che risalì la rocciosa cresta sud-orientale nel tardo pomeriggio, mentre le mitragliatrici del Tombolin obbligavano l’avversario a non esporsi sui parapetti delle trincee. Al prezzo di un paio di caduti, tra i quali il comandante del reparto (ten. Magalini), gli italiani catturarono 75 prigionieri, due mitragliatrici ed un riflettore con una settantina di fucili.
Da quel giorno la cresta di Cenon-Primalunetta divenne un caposaldo fortificato della linea italiana avanzata, con trinceramenti e sbarramenti di reticolati a 360°, in grado di resistere per giorni anche se completamente circondato. Ma, salvo azioni di disturbo da parte di pattuglie e occasionali tiri d’artiglieria, non venne mai attaccata. Nella conca sommitale sorse un vero e proprio villaggio di baracche in legno, di ricoveri blindati con sacchi di sabbia e pietrame, di rifugi in caverna. La posizione era dotata di due cannoni a tiro rapido da 42 mm, di quattro mitragliatrici pesanti Fiat 1914, di una sezione bombarde da 58 mm (su due armi), di una sezione lanciaspezzoni Bettica e di circa 250 fucilieri.
Nei primi giorni di novembre del 1917, nel contesto della ritirata generale dalle vette di Rava per il ripiegamento al Grappa dopo Caporetto, anche Cima Primalunetta e Monte Cenon furono evacuati senza combattere dalle forze italiane e rimasero nella profonda retrovia austriaca, meta solamente dei soldati e degli operai militarizzati addetti al recupero dei materiali e dei rifornimenti che gli italiani avevano abbandonato in grande quantità.Luca Girotto","Località turistica",0,0,,/var/castelivano/storage/images/territorio/cosa-visitare/a-spera/croz-de-primalunetta/20571-1-ita-IT/Croz-de-Primalunetta.jpg,,,,,,,,
45a2bfb3c4ca73db8d7a8bf5c6f523c9,2015-12-14T10:01:03+01:00,2015-12-14T10:01:03+01:00,"Chiesetta di Primalunetta","In località Primalunetta tra i prati della malga omonima, incontriamo la terza chiesetta di Spera, dedicata ai Santi Bartolomeo Apostolo e Lorenzo Martire.","
Fu costruita nel 1801 per iniziativa della famiglia Weiss di Strigno, proprietaria del terreno. Fu benedetta nel 1802, “con grande partecipazione di fedeli”, secondo quanto ricordano i documenti parrocchiali. La decorazione avvenne cent’anni più tardi (nel 1902).
Durante il primo conflitto mondiale, anche questa subì le ingiurie della guerra. Mani volenterose la ricostruirono e, nel 1925, avvenne la solenne inaugurazione, di cui si conservano ancora le foto.
Attualmente è di proprietà del Comune di Spera e fa parte del gruppo di edifici adibiti a colonia estiva e a struttura ricettiva.
E’ la più piccola e semplice delle tre chiese, ma non per questo la meno amata, per i piacevoli ricordi di migliaia di ragazzi che hanno frequentato il campeggio in questo ultimo quarto di secolo.L’interno non è decorato, ma a magnificare il Signore ci pensano la montagna e gli orizzonti circostanti.",Chiesa,0,0,,/var/castelivano/storage/images/territorio/cosa-visitare/a-spera/chiesetta-di-primalunetta/20585-1-ita-IT/Chiesetta-di-Primalunetta.jpg,,,,,,,,
96dc5521de0dd4d06cd1c4e6bc873d87,2015-12-14T10:01:53+01:00,2015-12-14T10:01:53+01:00,"Chiesa parrocchiale S.Maria Assunta","La chiesa di Santa Maria Assunta, originariamente intitolata alla Madonna delle Grazie, fu eretta nel 1711-1726 su luogo di una antica cappella.","
Si affacciava sulla piazza ed era preceduta da una scala monumentale. Nel 1898-1912 fu completamente rasa al suolo e ricostruita più ampia modificandone l’orientamento da nord all’attuale ovest. Unico elemento rimasto dell’impianto originario è il campanile. L’impianto planimetrico, molto chiaro e lineare, è quello di una chiesa a pianta rettangolare, ad aula unica con al centro due larghe espansioni ospitanti i due altari laterali, voltata a botte e a crociera, terminante in un lungo presbiterio raccordato con l’aula attraverso un arco santo a tutto sesto. Tutta la struttura architettonica è stata realizzata nello stile neoclassico di fine Ottocento. Durante la prima guerra mondiale subì gravissimi danneggiamenti e nel 1921 fu radicalmente restaurata. Meno significativi i tre altari ma riccamente intagliati i banchi lignei.
La decorazione delle volte è del pittore Angelo Molinari (1879-1952), un padre francescano all’epoca assai ricercato. Tutte le pareti, il presbiterio e l’abside sono invece state dipinte, nell’estate del 1929, dal pittore Anton Sebastian Fasal (1899-1943) che, dopo aver studiato all’Accademia di Belle Arti di Vienna presso Maestri legati a Gustav Klimt, si trasferì in Alto Adige, a Bressanone e poi a Bolzano, e fu attivo soprattutto nella decorazione di chiese, sia in Alto Adige che, ancora di più, in Trentino. Importanti in particolare i suoi interventi nelle chiese di Samone, Strigno e Ospedaletto; in Valle del Fersina a Frassilongo; a Trento e nelle sue vicinanze in diverse altre chiese; in Val Concei in quelle di Locca, Engusio e Lenzumo; in Alto Adige a Egna e a Montal presso Brunico. Il suo intervento pittorico, comprensivo pure delle vetrate, risulta altamente complesso e articolato, assumendo in pieno l’aspetto di un esteso progetto catechetico che si sviluppa congiuntamente attraverso un gran numero di scritte, di immagini figurative e di raffigurazioni simboliche, combinate insieme in un unico inscindibile. Stilisticamente si richiama alle esperienze della tarda Secessione viennese. Anche dal punto di vista esecutivo l’intervento di Fasal è assai ricco e differenziato, prevedendo sia la tecnica dell’affresco che della pittura a secco e del graffito.Fermiamo l’attenzione sulle maggiori campiture: nelle due grandi lunette laterali a destra l’Adorazione dei Magi ed a sinistra la Fuga in Egitto.Nella fiancata a destra il Battesimo di Gesù; in quella di sinistra due Stemmi araldici uno raffigurante il principe vescovo Celestino Endici e l’altro il papa Pio XI Ratti e la raffigurazione della Parabola del Figliol Prodigo; nel presbiterio San Francesco e Sant’Antonio, la Crocifissione, San Pietro e San Paolo, una Annunciazione e una variegata Simbologia Mariana e sulla volta del presbiterio i Quattro Evangelisti. In controfacciata il Sermone sulla Montagna e i Ritratti dei sacerdoti che ne hanno seguito la ricostruzione; fitte decorazioni di gusto modernista, angeli , lesene, fregi, cornici a nastri intrecciati, motivi geometrici e floreali che richiamano lo stile Liberty del primo ventennio del secolo scorso riempiono ogni spazio lasciato libero dalle figurazioni, accentuando la preziosità dell’ambiente. Un recente intervento di restauro (2006) lo ha esaltato come merita.",Chiesa,0,0,,/var/castelivano/storage/images/territorio/cosa-visitare/a-spera/chiesa-parrocchiale-s.maria-assunta/20599-1-ita-IT/Chiesa-parrocchiale-S.Maria-Assunta.jpg,,,,,,,,
b247e4492948c6381ab63b7928477a58,2015-12-14T10:02:42+01:00,2015-12-14T10:02:42+01:00,"Chiesa di S.Apollonia","Nella zona est di Spera, in località Paterni, il primo nucleo abitato del paese, sorge la chiesa di santa Apollonia, in origine detta di Santa Croce, la più antica del paese.","
Precedentemente cappellania, la chiesa fu elevata a curazia della pieve di Strigno nel 1660. Ricordata negli atti visitali del 1531, risale almeno al XIV secolo. E’ inclusa entro la bassa cortina muraria che circonda e delimita tutto il cimitero dalle semplici sepolture terragne, recentemente ampliato e risistemato. Ampliata nel 1603-1606 e restaurata nel 1767, ha un esterno assolutamente semplice, con una struttura a pianta rettangolare sulla quale si innesta il presbiterio. La facciata presenta al centro una porta di accesso protetta da un tettuccio di scandole sporgente e ai lati due finestrelle rettangolari simmetriche, più in alto una finestra ad oculo e un’altra apertura circolare che arieggia il sottotetto. Il tetto è a due spioventi. Sul colmo una leggera struttura per custodire la campana in bronzo ( in sol #, di 56 kg, consacrata il 19 novembre 1922). Il grezzo intonaco lascia intravedere il muro di materiali vari.
Superata la soglia si scendono alcuni gradini. L’interno è costituito da un’unica aula, lastricata in pietra, coperta da un soffitto piano, illuminata da una finestra rettangolare ma ben più stretto, corto e basso dell’aula, e coperto da una volta a crociera, ha una finestra ad oculo sulla parete di fondo; è unito all’aula attraverso un arco santo voltato a tutto sesto. Sul fianco settentrionale si trova la piccola sacrestia. Sulla parete meridionale e sulla controfacciata si conserva un significativo ciclo di affreschi di un pittore provinciale del Trecento, “opera di un artista che vive ancora, forse già nel Quattrocento, dei resti dell’eredità trecentesca veneta”. Sono affiancabili a quelli delle chiese di san Valentino a Scurelle e di sant’Ippolilto a Castel Tesino. Rimessi in luce e ripuliti nel 1966, sono ben leggibili in specifico Cristo nel sepolcro “Passo”, santa Caterina da Alessandria, la Madonna in trono col Bambino, un santo vescovo, san Giobbe, un’altra Madonna col Bambino, questa volta benedicente.
E’ dotata di tre esclusivi altari lignei. Il maggiore, entro il presbiterio, è un pregevole esempio di altare tardo rinascimentale realizzato entro la metà del XVII secolo. Al centro dell’ancona, a sottolineare la funzione cimiteriale della chiesa e la sua antica intitolazione, il gruppo plastico del Cristo crocifisso fra due angeli, mentre le figure ai lati in rilievo rappresentano la Vergine Addolorata e San Giovanni. Più all’esterno san Pietro (a sinistra) e san Zenone (a destra), in omaggio alla chiesa pievana di Strigno anticamente intitolata appunto a san Zenone. Sulla sommità si notano due angeli adagiati in timpani curvilinei spezzati. Raffinato l’intaglio e notevole l’antipendio con cariatidi. I due altari minori sono collocati ai lati dell’arco santo. Quello sinistro, realizzato verso la metà del Seicento, presenta una decorazione policroma a tralci di vite sulle due colonne e a volute e grappoli di frutta all’esterno di queste. Notevole per la cesellatura dell’intaglio l’antipendio. La pala raffigura la Madonna col Bambino e santi: su un cielo dorato la Vergine e il Figlio incoronati, in basso i santi Apollonia e Giobbe oltre al committente, don Simone Paterno, colto di profilo in atteggiamento orante e la data di esecuzione: 1651. Accanto all’altare un’epigrafe ricorda la generosità di questo benefattore, che fu il primo curato di Spera.
L’altare laterale destro è stato recentemente attribuito da Raffaella Colbacchini, dell’Ufficio Beni Storico-Artistici della Provincia autonoma di Trento, ai fratelli Melchiore e Giovanni Zugna, intagliatori originari della Val Badia attivi anche a Strigno fra il 1650 e il 1679. La solo apparente semplicità strutturale è fortemente contraddetta da una più attenta analisi degli elementi che lo compongono: l’arco spezzato, la predella, le mensole, le colonne, i capitelli, i plinti, tutti fortemente aggettanti o rientranti, fittamente intagliati, dorati e dipinti in vivace policromia. Il lavoro di intaglio a motivi floreali, animali e teste d’angelo, pare particolarmente esemplare e assai accurato. La pala, come attesta il cartiglio in basso al centro, è stata dipinta nel 1679 dal noto pittore barocco di Borgo Valsugana Lorenzo Fiorentini junior (1638-1696). Raffigura in alto, fra un tripudio di angeli, la Madonna col Bambino e santi: ai lati Rocco e Antonio da Padova e in basso Giovanni Evangelista fra Vittore e Corona. Questi ultimi due, ben riconoscibili per l’essere lui in armatura e reggente una bandiera con l’immagine di un castello e la sua compagna con in mano una corona, sono i protettori di Feltre venerati nel loro santuario che sorge fuori da quella città. La tela “manifesta, assieme ad una disinvolta esecuzione, certe durezze metalliche”che Lorenzo avrebbe “ereditate dal padre”.
Anche quando, conseguentemente alla costruzione della nuova chiesa in centro paese, questa di santa Apollonia divenne una semplice cappella cimiteriale, mantenne intatto il favore degli abitanti. Negli atti visitali del 1864 appariva ormai di dimensioni troppo ridotte rispetto all’aumentata popolazione , tanto che si consigliava, se non fosse stato possibile né convincere la gente a frequentare la curaziale né ingrandire quella chiesa cimiteriale, almeno di realizzare sopra il suo ingresso principale “una spaziosa e ben regolata Cantoria per la quale non occorre grande dispendio “. Tale cantoria venne effettivamente realizzata nel 1926.E’ stato eseguito negli scorsi anni un articolato intervento di restauro che ha interessato sia il complesso architettonico che gli affreschi e gli altari valorizzandoli come meritano.",Chiesa,0,0,,/var/castelivano/storage/images/territorio/cosa-visitare/a-spera/chiesa-di-s.apollonia/20613-1-ita-IT/Chiesa-di-S.Apollonia.jpg,,,,,,,,
0d75a785ab473650b9f95611c935b6d4,2015-12-02T11:22:10+01:00,2015-12-14T10:05:57+01:00,"La metamorfosi delle Streghe","La mostra permanente denominata &quot;La metamorfosi delle streghe&quot; propone una rappresentazione del mondo e delle forze invisibili che lo animano, eternamente in bilico tra il Bene e il Male, binomio sempre attuale e dibattuto.","Mostra di sculture lignee dell'artista Carlo Scantamburlo, visitabile all'interno della sede municipale negli orari di apertura degli uffici comunali.Pubblicazioni: la metamorfosi delle streghe (Carlo Scantamburlo)La metamorfosi delle streghedi Mercoledì, 01 Luglio 2015Dove: comune di Villa Agnedo",,0,0,,/var/castelivano/storage/images/territorio/cosa-visitare/a-villa-agnedo/la-metamorfosi-delle-streghe/19454-2-ita-IT/La-metamorfosi-delle-Streghe.jpg,,,,,,,,
