remoteId,published,modified,Titolo,Descrizione,"Tipologia di luogo",lat,lon,address,Immagine,Comune,Tags,"Leggi le informazioni dettagliate"
"csvimport_Arte Sella - Malga Costa_luogo",2012-10-29T18:21:20+01:00,2017-03-26T16:50:48+02:00,"Arte Sella - Malga Costa","Arte Sella è una manifestazione internazionale di arte contemporanea nata nel 1986, che si svolge all’aperto nei prati, nei boschi della Val di Sella (comune di Borgo Valsugana, provincia di Trento).","Percorso naturalistico",46.001582,11.3682,,/var/comunitavalsugana/storage/images/il-territorio/principali-luoghi-di-interesse/arte-sella-malga-costa/510094-1-ita-IT/Arte-Sella-Malga-Costa1.jpg,"Comune di Borgo Valsugana",,
"csvimport_Grotte di Castello Tesino_luogo",2012-10-29T18:21:20+01:00,2017-07-24T12:24:11+02:00,"Grotte di Castello Tesino","Le Grotte di Castello Tesino si aprono nella selvaggia gola scavata tra il Monte Agaro ed il Monte Coppolo. Sono state scoperte nel 1926 dal geometra Da Rugna di San Donato. Ben presto la cavita venne attrezzata per permettere lo sfruttamento a scopo turistico e, da allora, è visitata da molti appassionati. Ha uno sviluppo complessivo di circa 400 metri e la sua completa esplorazione non ha potuto a tutt´oggi essere effettuata.","Percorso naturalistico",46.088586,11.681461,"grotta, castello tesino, Trentino-Alto Adige, Italia",/var/comunitavalsugana/storage/images/vivere-la-comunita/principali-luoghi-di-interesse/grotte-di-castello-tesino/510102-1-ita-IT/Grotte-di-Castello-Tesino.jpg,"Comune di Castello Tesino",,http://www.visittrentino.it
"csvimport_Grotta della Bigonda_luogo",2012-10-29T18:21:20+01:00,2017-07-24T12:22:07+02:00,"Grotta della Bigonda","
La grotta della Bigonda (o Vigondola) è una grotta naturale che si trova in Valsugana, nei pressi di Selva di Grigno, in Provincia di Trento, sulla sponda destra del fiume Brenta. 
E’ la più grande grotta del Trentino, spettacolare e ancora in esplorazione, visitabile tutto l’anno.E’ la più ampia grotta trentina e una delle maggiori d’Italia: al suo interno si sviluppano oltre 27 km di gallerie, ancora in esplorazione, con dislivelli compresi da + 35 a -100 metri. È stata scoperta nel 1952 da alcuni giovani della vicina Selva di Grigno e da più di quarant’anni si continuano ad esplorare le numerose gallerie orizzontali che si sviluppano su tre piani, collegati tra loro da pozzi verticali.","Percorso naturalistico",46.018163,11.580997,"bigonda, Trentino-Alto Adige, Italia",/var/comunitavalsugana/storage/images/vivere-la-comunita/principali-luoghi-di-interesse/grotta-della-bigonda/510110-1-ita-IT/Grotta-della-Bigonda.jpg,"Comune di Grigno",,
"csvimport_Castel Telvana_luogo",2012-10-29T18:21:21+01:00,2017-03-24T11:24:34+01:00,"Castel Telvana",,Castello,46.057613,11.459255,,/var/comunitavalsugana/storage/images/il-territorio/principali-luoghi-di-interesse/castel-telvana/510126-1-ita-IT/Castel-Telvana.jpg,"Comune di Borgo Valsugana",,
"csvimport_Castel Ivano_luogo",2012-10-29T18:21:21+01:00,2017-04-04T15:18:23+02:00,"Castel Ivano","Prestigioso castello tra i meglio conservati del Trentino che sorge a Ivano Fracena in Valsugana. La famiglia Staudacher, attuale proprietaria di Castel Ivano e artefice del lavoro di restauro e di conservazione del maniero e dei suoi parchi.",Castello,46.056191,11.528853,,/var/comunitavalsugana/storage/images/il-territorio/principali-luoghi-di-interesse/castel-ivano/510134-1-ita-IT/Castel-Ivano.jpg,,,http://www.castelivano.it/|www.castelivano.it
csvimport_Castellalto_luogo,2012-10-29T18:21:22+01:00,2017-03-24T11:21:56+01:00,Castellalto,"I ruderi del castello di Castellalto si ergono sulla sommita del monte sovrastante Telve Valsugana circondati da un bosco di abete rosso e larice.",Castello,46.080532,11.474399,,/var/comunitavalsugana/storage/images/il-territorio/principali-luoghi-di-interesse/castellalto/510142-1-ita-IT/Castellalto.jpg,"Comune di Telve",,
"csvimport_Museo Casa De Gasperi_luogo",2012-10-29T18:21:22+01:00,2017-07-24T12:20:31+02:00,"Museo Casa De Gasperi","La casa natale di Alcide De Gasperi, a Pieve Tesino in provincia di Trento, è stata trasformata in un museo a lui dedicato. Le stanze di questo piccolo edificio ottocentesco offrono ai visitatori la suggestiva ambientazione di un viaggio alla scoperta delle origini di uno dei padri dell'Italia repubblicana e dell'Europa unita. L'esperienza proposta dal Museo Casa De Gasperi, inaugurato il 18 agosto 2006, è un percorso che a partire dal profondo legame di De Gasperi con la sua terra d'origine - un motivo ricorrente in tutta la sua vita - porta il visitatore ad indagare i più importanti aspetti della vicenda personale e politica dello statista trentino.",Museo,46.068988,11.606973,,/var/comunitavalsugana/storage/images/vivere-la-comunita/principali-luoghi-di-interesse/museo-casa-de-gasperi/510150-1-ita-IT/Museo-Casa-De-Gasperi.jpg,"Comune di Pieve Tesino",,http://www.degasperitn.it/it/museo-de-gasperi
"csvimport_Mostra permanente della Grande Guerra_luogo",2012-10-29T18:21:22+01:00,2017-07-24T12:18:47+02:00,"Mostra permanente della Grande Guerra","Allestita all’interno dell’ex Mulino Spagolla in uno degli angoli fluviali più suggestivi del centro storico di Borgo, la Mostra Permanente della Grande Guerra in Valsugana e sul Lagorai è il risultato dell’impegno pluriennale dell’Associazione Storico-Culturale della Valsugana Orientale e del Tesino che ha tra i suoi scopi quello di conservare, studiare e valorizzare le testimonianze materiali, bibliografiche, archivistiche e fotografiche relative alla Grande Guerra nell’area compresa tra l’Altopiano dei Sette Comuni, la Valsugana e la catena del Lagorai-Cima d’Asta",Museo,46.053875,11.459258,,/var/comunitavalsugana/storage/images/vivere-la-comunita/principali-luoghi-di-interesse/mostra-permanente-della-grande-guerra/510158-1-ita-IT/Mostra-permanente-della-Grande-Guerra.jpg,"Comune di Borgo Valsugana",,
"csvimport_Mulino Angeli / Casa Museo degli Spaventapasseri_luogo",2012-10-29T18:21:23+01:00,2017-07-24T12:14:13+02:00,"Mulino Angeli / Casa Museo degli Spaventapasseri","A Marter, piccola frazione del Comune di Roncegno Terme, c’è un museo del tutto particolare. Un tempo importante mulino per il grano, granoturco ed altri cereali coltivati in Valsugana, “Mulino Angeli”, una volta entrato in disuso, è stato acquisito dall’ amministrazione comunale e sottoposto ad imponenti lavori di restauro conservativo che ne hanno rinverdito l'imponente struttura e la complessita dell'attivita molitoria ospitata per secoli. Il mulino è stato adibito a sede museale.",Museo,46.033173,11.392999,,/var/comunitavalsugana/storage/images/vivere-la-comunita/principali-luoghi-di-interesse/mulino-angeli-casa-museo-degli-spaventapasseri/510166-1-ita-IT/Mulino-Angeli-Casa-Museo-degli-Spaventapasseri.jpg,"Comune di Roncegno Terme",,
"csvimport_Pista ciclabile della Valsugana_luogo",2012-10-29T18:21:23+01:00,2017-08-01T17:39:25+02:00,"Pista ciclabile della Valsugana","

Pista Ciclabile Valsugana

    drawData(""https://www.openstreetmap.org/api/0.6/relation/275663/full"",""8aad2fd888ecb5dded925a8b5ba4bc1a"");

La ciclopista della Valsugana, che collega il cristallino Lago di Caldonazzo con la splendida Bassano del Grappa, è un vero e proprio paradiso per tutti gli appassionati delle due ruote a pedali: 80 km lungo i quali si intrecciano cultura, storia e paesaggi naturali davvero unici a cavallo tra Trentino e Veneto. Due regioni legate da un passato storico condiviso e contraddistinte da un comune “ elemento fluviale” che accarezza dolcemente il fondovalle: il fiume Brenta. Le sue acque vi accompagnano lungo un percorso facile, prevalentemente pianeggiante, adatto a tutti per trascorrere piacevoli ore in liberta all’insegna dello sport e del contatto con la natura.","Pista ciclabile",46.052671,11.470119,"ciclabile Valsugana, Trentino-Alto Adige, 38050, Italia",/var/comunitavalsugana/storage/images/vivere-la-comunita/principali-luoghi-di-interesse/pista-ciclabile-della-valsugana/510174-1-ita-IT/Pista-ciclabile-della-Valsugana.jpg,"Comune di Novaledo
Comune di Roncegno Terme
Comune di Borgo Valsugana
Comune di Castelnuovo
Comune di Ospedaletto
Comune di Grigno",,
7c5b3003751acf7b9a1f96d334810faf,2014-02-18T15:09:01+01:00,2014-02-18T15:09:01+01:00,"CRM di Telve","Indirizzo: Localita Nale c/o magazzino comunale - 38050 Telve",,46.06866,11.483093,,,,,
9d9f479da4fd9092093e7dfa20aa0ee4,2014-02-18T15:10:16+01:00,2014-02-18T15:10:16+01:00,"CRM di Telve di Sopra","Indirizzo: Localita Praggia c/o zona sportiva - 38050 Telve di Sopra",,46.074522,11.464367,,,,,
3f7f3a359d405d01116ef3c22f04b26f,2014-02-18T15:12:00+01:00,2017-03-27T08:43:22+02:00,"CRM di Castel Ivano (Agnedo)","Indirizzo: Via Capelline (a Nord della zona sportiva) - Frazione di Agnedo - 38059 Castel Ivano",,46.054791,11.524034,,,,,
0088ea388823134f8908670ade07f795,2014-02-18T15:13:09+01:00,2015-04-29T11:17:29+02:00,"CR e CRZ di Borgo Valsugana","Indirizzo: Via Puisle - Zona Industriale (a Est dell'acciaieria) - 38051 Borgo Valsugana",,46.050212,11.446862,,,,,
bad50fe4b4898885fae3484c2e799635,2014-02-18T15:14:36+01:00,2015-04-29T11:18:13+02:00,"CR e CRZ di Scurelle","Indirizzo: Localita Solizzan (nell'area della discarica) - 38050 Scurelle",,46.078753,11.49927,,,,,
4ad118ee43c4607e7cbad465c0d5263e,2014-02-17T12:44:39+01:00,2015-04-29T11:09:15+02:00,"CRM di Castello Tesino","Indirizzo: Localita Col delle Bagole - 38053 Castello Tesino",,46.06668,11.653526,,,,,
4de2a2cbdf136548f2b74c638da0c6b2,2014-02-17T12:48:52+01:00,2015-04-29T11:11:33+02:00,"CRM di Castelnuovo","Indirizzo: Viale Venezia (dietro Casamarket) - 38050 Castelnuovo",,46.050823,11.497512,"Viale Venezia",,,,
9cab84206bdb27d61bed002b58973486,2014-02-17T12:51:40+01:00,2014-02-17T12:51:40+01:00,"CRM di Grigno","Indirizzo: Zona Industriale c/o magazzino comunale - 38055 Grigno",,46.005994,11.647283,,,,,
821a9019cf4d13b713455ecf4f6201c0,2014-02-17T12:53:48+01:00,2014-02-17T12:53:48+01:00,"CRM di Ospedaletto","Indirizzo: Localita Pradanella - 38050 Ospedaletto",,46.035713,11.569016,"Localit&agrave; Pradanella Ospedaletto",,,,
281a31075c1e7a95549edd5bc5f52acc,2014-02-17T12:55:39+01:00,2014-02-17T12:55:39+01:00,"CRM di Roncegno Terme","Indirizzo: Frazione Marter - Localita Lago Morto (a ovest della cava)",,46.03394,11.400824,,,,,
0bde98f4a34a6e668a708c4b3ff1530b,2014-02-17T12:57:41+01:00,2014-02-17T12:57:41+01:00,"CRM di Ronchi Valsugana","Indirizzo: Localita Stauda - 38050 Ronchi Valsugana",,46.06313,11.429341,,,,,
ccc21c265d05d00005837e0b1a256a41,2014-02-17T12:59:32+01:00,2017-03-27T08:42:34+02:00,"CRM di Castel Ivano (Strigno)","Indirizzo: Via Marconi (sopra la ex caserma) - Frazione di Strigno - 38059 Castel Ivano",,46.070901,11.5222,,,,,
9fe40975dd8e0db62d966223a379efa0,2015-03-04T10:01:56+01:00,2017-03-26T17:23:16+02:00,"Museo PER VIA","Il Museo PER VIA è realizzato in una casa di paese, un luogo normale dove ricordare e raccontare una quotidianita speciale: quella dell'epopea dei venditori ambulanti tesini. Il Museo custodisce la storia della vicenda collettiva che più fortemente ha caratterizzato secoli di vita in questa valle alpina della provincia autonoma di Trento. Situato nel cuore di Pieve Tesino, il Museo raccoglie la memoria di un’intera vallata e dei suoi tre paesi, mantenendo due diverse prospettive: quella maschile di quanti partivano lasciando le loro case e percorrendo a piedi itinerari impensabili alla ricerca delle migliori piazze di vendita, e quella delle loro famiglie, che rimanevano nei paesi della valle ad affrontare le non meno dure sfide della quotidianita alpestre. Fortemente voluto dalla comunita locale, realizzato dall'Amministrazione comunale di Pieve Tesino e inaugurato ad aprile 2014, la gestione culturale del Museo è attualmente affidata alla Fondazione Trentina Alcide De Gasperi.",Museo,46.068925,11.607243,"pieve tesino",/var/comunitavalsugana/storage/images/il-territorio/principali-luoghi-di-interesse/museo-per-via/2386981-1-ita-IT/Museo-PER-VIA.jpg,,,http://www.museopervia.it
6aebf8693efbcd7754188ac782428052,2017-03-24T09:41:41+01:00,2017-03-24T09:41:41+01:00,"Castel Ivano",,Castello,46.055968,11.529129,"Castel Ivano, Via Staudacher, Ivano, Castel Ivano, Comunit&agrave; Valsugana e Tesino, TN, Trentino-Alto Adige, 38059, Italia",,,,
01b717c496c5ff1c053c6e26e396442c,2017-04-22T12:04:44+02:00,2017-04-22T15:42:29+02:00,"Samone: recupero aree boscate","L'intervento prevede il recupero di aree agricole marginali sovrastanti al paese di Samone ora boscate. La posizione di tali aree ricopre un notevole valore dal punto di vista paesaggistico e agricolo. L'area interessata è di circa 5 ettari.","Infrastrutturazione turistica",46.083828,11.520281,"samone (tn), Samone, Trentino-Alto Adige, 38059, Italia",,,,
00e25a01ed820a864017daf243bea101,2017-04-22T15:49:31+02:00,2017-04-22T16:04:58+02:00,"Castello Tesino: Colle Sant'Ippolito","Vista l'importanza per il territorio del Tesino del percorso storico-naturalistico-turistico della via Claudia-Augusta Altinate si intende sistemare il percorso che dal Ponte Romanico sale verso il Colle di Sant'Ippolito e il percorso che parte dalla Frazione Coronini e che scende verso il Torrente Senaiga, collegandosi con il tracciato presente sul C.C. di Lamon. All'interno di questo progetto di sistemazione si intende inserire anche i lavori di recupero degli scavi archeologici del Colle di Sant'Ippolito.Importo richiesto: Euro 120.000","Via Claudia Augusta",46.065497,11.630691,"Ippolito, Castello Tesino, Trentino-Alto Adige, Italia",,,,
97260e52b606a1677961a0b6f43f3949,2017-04-22T15:54:58+02:00,2017-05-20T10:20:37+02:00,"Bieno: percorso ciclopedonale Lusumina","
Al fine di completare i collegamenti fra i vari settori della strada che componeva la via Claudia Augusta Altinate, si ritiene necessario provvedere alla realizzazione di un tratto di sentiero che colleghi la frazione Lusumina con la zona posta a valle dell'abitato di Bieno e denominata delle Scalette. 
Il nuovo accesso dovra garantire il solo transito pedonale nonché quello di biciclette, al fine di garantire la sicurezza ai diversi utenti e cicloturisti che frequentano la zona del Tesino e Bieno e che risultano attratti dal percorso della via Claudia Augusta.Tale sentiero di collegamento servira, inoltre, per &quot;chiudere&quot; a mo' di ipotetico cerchio una delle passeggiate più apprezzate dai censiti e turisti, ovvero quella di Lasta e Castrozze.Importo richiesto: Euro 150.000","Via Claudia Augusta",46.072189,11.544142,"Lusumina, Bieno, Trentino-Alto Adige, Italia",,,,
c523f64d67e6b8aa10cc573d6436180d,2017-04-22T16:25:35+02:00,2017-05-03T15:42:16+02:00,"Carzano: Valtrighetta / Telve, Telve di sopra e Carzano: collegamento rete elettrica Val Calamento","
L'intervento si divide in due parti strettamente connesse:Valtrighetta: Il progetto riguarda i lavori di completamento dello stabile “Valtrighetta” da adibire ad albergo-bar-ristorante. L’edificio è necessario al rilancio turistico dell’asse del Manghen, dove si registra un forte passaggio di turisti durante la stagione estiva-autunnale. L’area di Valtrighetta è il centro di un’importante Oasi WVVF frequentata nel corso dell’intero anno. I lavori riguardano il completamento della parte interna dell’edificio: in particolare dell’impianto termico, elettrico e della ristrutturazione interna.Importo: Euro 477.020Collegamento rete elettrica val Calamento: I tre comuni di Telve, Telve di sopra e Carzano intendono presentare una proposta congiunta di progetto per la realizzazione dell’elettrificazione del tratto della Val Calamento che dalla zona Prati di Calamento arriva fino alla struttura di malga Valsolero. Questo intervento fa parte di un progetto complessivo messo in atto dai comuni per rilanciare l’attivita turistica nella zona montana della val Calamento e risulta propedeutico ai successivi investimenti necessari alla realizzazione del progetto “Albergo rurale”. (Comuni di Telve, Telve di sopra e Carzano)Importo: Euro 400.000","Infrastrutturazione turistica",46.153434,11.439316,"Carzano, Trentino-Alto Adige, Italia",,,,
b26e74f8b05ab744ee2b0407bacd5eef,2017-04-22T16:31:59+02:00,2017-04-22T16:31:59+02:00,"Castel Ivano: palestra di arrampicata sportiva","L'intervento riguarda il completamento delle pareti di arrampicata interne della nuova palestra, la conclusione di finiture interne e dell'impiantistica dell'edificio, oltre alla realizzazione di un'area verde e a parcheggio a servizio del Centro Sportivo. La palestra ha un bacino di utenza che abbraccia non solo il territorio della Comunita di valle ma si propone a un territorio più ampio con un potenziale bacino di utenza provinciale e del nord Italia con particolare afferenza al vicino Veneto dove mancano strutture di questo tipo ma vi è particolare interesse alla disciplina dell'arrampicata. La struttura è stata studiata per le tre discipline dell'arrampicata sportiva (speed, lead, bulder), avvicinamento alla disciplina dell'arrampicata, formazione dei volontari del Soccorso Alpino dei vigili del fuoco volontari, collaborazioni scientifiche (SAT, MUSE, ecomusei, ecc.).Importo richiesto: Euro 462.312,25","Infrastrutturazione turistica",46.052759,11.522985,"Castel Ivano, Trentino-Alto Adige, 38051 , Italia",,,,
f9c88520d568c510c38c69d91d07dc8b,2017-04-22T16:43:29+02:00,2017-04-22T16:43:29+02:00,"Comunita Valsugana e Tesino: Scuola alberghiera e alta formazione","
L'Alta Formazione Professionale Istruzione Tecnica Superiore offre ai diplomati una nuova opportunita formativa alternativa al percorso universitario. Forma figure manageriali nell'ambito dell'organizzazione e della gestione di strutture ricettive, figure capaci di inserirsi da subito nel tessuto ricettivo e turistico e rispondere alle esigenze del mercato quali innovazione, professionalita, opportunita e occupazione. I percorsi formativi attivi nel Comune di Roncegno Terme sono: IV anno del Corso Tecnico della Ristorazione, “Cucina regionale italiana”, “Tecnico dei servizi “accoglienza sala bar”, Corso di Alta Formazione Professionale in “Hospitality Management”.
E’ emersa la necessita di rafforzare la presenza dell’Istituto Alberghiero in Valsugana e Tesino alla luce della continua crescita avuta negli ultimi 8 anni attraverso l'individuazione di spazi più adeguati alle esigenze della Scuola.La proposta di intervento si concretizza nella richiesta alla Provincia di acquisire lo stabile &quot;Villa Angiolina&quot; per destinarlo a sede dell'istituto alberghiero. La Comunita Valsugana e Tesino, per dimostrare l’alto interesse alla presenza della scuola, si impegnerebbe attraverso una compartecipazione finanziaria alle spese di arredo.Importo richiesto: Euro 300.000","Infrastrutturazione turistica",46.047993,11.410493,"Roncegno Terme, Trentino-Alto Adige, 38051 , Italia",,,,
72f66b96f4f2a93cc17711c292c3298d,2017-04-22T16:47:09+02:00,2017-04-22T16:47:09+02:00,"Cinte Tesino: parco avventura","Si propone la realizzazione di un parco avventura (acropark) nelle vicinanze degli impianti sportivi di Cinte Tesino. Il parco sara attrezzato con differenti percorsi, per tutte le eta e diversi tipi di agilita. Sara inoltre adibito ad attivita didattiche per scuole, associazioni sportive e operatori turistici.Importo richiesto: Euro 180.000","Infrastrutturazione turistica",46.059028,11.617441,"Cinte Tesino, Trentino-Alto Adige, Italia",,,,
2c7ea9d72030c178812def2d6439d97e,2017-04-22T16:54:12+02:00,2017-04-22T16:54:12+02:00,"Grigno: strada degli altipiani","Si intende procedere con degli ulteriori interventi di &quot;messa in sicurezza&quot; della strada che collega l'altipiano di Marcesina, popolato di malghe, un rifugio escursionistico e altri edifici di proprieta comunale.La strada rappresenta una importante valorizzazione e completamento della pista ciclabile della Valsugana in quanto notevolmente apprezzata dai ciclisti nel periodo estate/autunno. Infatti la viabilita si snoda per 12 chilometri con un dislivello di circa 1000 metri, sviluppando 19 tornanti e per lunghi tratti avendo pendenza costante. La strada &quot;degli Altipiani&quot;, realizzata durante la prima guerra mondiale, risulta ben descritta dal punto di vista storico nel libro di Luca Girotto &quot;L'ultima strada dell'Impero&quot; e il Comune di Grigno ne ha gia proposto la valorizzazione attraverso l'esposizione di alcuni totem con le fotografie a testimonianza dei diecimila uomini che hanno partecipato alla sua realizzazione.Importo richiesto: Euro 300.000","Infrastrutturazione turistica",46.009988,11.59255,"Ospedaletto, Trentino-Alto Adige, 38051 , Italia",,,,
2fb9c61924fbda6a7e7d899491f03acf,2017-04-22T16:59:02+02:00,2017-04-22T16:59:02+02:00,"Novaledo: malga Broi","L'amministrazione comunale propone di eseguire interventi di manutenzione straordinaria di malga Broi per migliorarne la fruibilita e utilizzo: sostituzione della copertura e e dei serramenti, realizzazione di nuovo impianto fotovoltaico per la produzione di energia a servizio degli appartamenti.Importo richiesto: Euro 130.000","Infrastrutturazione turistica",46.042229,11.356323,"Novaledo, Trentino-Alto Adige, 38051 , Italia",,,,
66d6a2cbbd254176ed598ad5b10680f3,2017-04-22T17:13:05+02:00,2017-05-03T15:29:05+02:00,"Pieve Tesino: Percorso mountain bike Pieve Tesino/Castel Ivano","Il progetto prevede la realizzazione di un tratto di pista forestale in localita Chieppena/Ravacena al fine di collegare il comune di Pieve Tesino con il comune di Castel Ivano. Questo collegamento permettera ai bikers provenienti dalla Valsugana e in particolare dal comune di Castel Ivano percorrendo la strada forestale tipo B “Chieppena-Ravacena” di arrivare in loc. Pradellano (Pieve Tesino) e poter quindi accedere ai 160 km circa di percorsi mountain bike che verranno messi in opera nel corso del 2017 nei comuni del Tesino e Bieno. (Comune di Pieve Tesino).Importo richiesto: Euro 50.000","Infrastrutturazione turistica",46.072218,11.567101,"Scurelle, Trentino-Alto Adige, 38051 , Italia",,,,
c48e2040caaff5eb59c793ee11d4088f,2017-04-22T17:21:40+02:00,2017-04-22T17:21:40+02:00,"Roncegno Terme: colonia Trenca","L'edificio denominato &quot;Colonia Trenca&quot; è situato sulla montagna di Roncegno Terme a una quota di circa 1600m nei pressi dell'omonima malga. La struttura è in grado di ospitare circa 50 persone L'edificio è organizzato con locali destinati all'alloggio degli ospiti, cucina e sala mensa al livello superiore e con locali di servizio e spazi per attivita comuni al piano inferiore. Da alcuni anni l'immobile non viene più utilizzato in quanto non risulta più adeguato alle normative vigenti: in particolare sono indispensabili degli interventi per adeguare gli impianti tecnologici e il locale cucina nonché altri interventi per razionalizzare gli spazi e rendere efficiente tutto l'edificio dal punto di vista energetico. Per questo tipo di strutture la richiesta è notevole in quanto non esistono molti immobili di tali dimensioni e gia attrezzati per ospitare un consistente numero di persone, pertanto risultano molto ricercati da parte di parrocchie, gruppi scout e associazioni in genere per l'organizzazione di campeggi e raduni di ragazzi. Nei pressi della struttura transitano il sentiero Europeo E5 e l'ippovia della Valsugana. La colonia è raggiungibile tutto l'anno.Importo richiesto: Euro 250.000","Infrastrutturazione turistica",46.078612,11.392726,"Trenca, Trentino-Alto Adige, Italia",,,,
5ddbf7cb4d57a22d058434d323917d66,2017-04-22T17:30:46+02:00,2017-04-22T17:30:46+02:00,"Ronchi Valsugana: malga Prima busa","L'Amministrazione comunale di Ronchi Valsugana intende proporre la realizzazione di un acquedotto a uso potabile a servizio della struttura denominata &quot;Malga Prima Busa&quot; in c.c. Torcegno, di proprieta del Comune di Ronchi Valsugana. L'intervento risulta necessario a garantire i requisiti igienico-sanitari della struttura di tipo risto/ricettiva gia presente presso detto complesso, ma a ora non utilizzata a tale scopo.Importo richiesto: Euro 140.500","Infrastrutturazione turistica",46.097043,11.423228,"busa, Trentino-Alto Adige, 38050, Italia",,,,
bc6d74833e9fbfaca01fbcfee1f4eb68,2017-04-22T17:38:44+02:00,2017-04-22T17:38:44+02:00,"Telve di sopra: malga Casabolenga","Malga Casabolenga è immersa nel paesaggio montano della Val Calamento in prossimita dell'oasi naturalistica del W.W.F.. La struttura è l'unica attivita agro/turistica presente nel Comune di Telve di sopra. La Malga è attualmente monticata. Nel complesso è presente un laboratorio per la lavorazione del latte con produzione di burro, formaggi ecc. La struttura è dotata di generatore per la produzione di energia elettrica, ma è in previsione di dotare l'area montana della linea elettrica. L'adeguamento/messa a norma igienico sanitaria permettera di migliorare l'offerta dei prodotti ai turisti di passaggio, mediante la vendita diretta ed è possibile prevedere un evoluzione con possibilita di ristorazione/agrituristica.Importo richiesto: Euro 150.000","Infrastrutturazione turistica",46.153616,11.408787,"Telve, Borgo Valsugana, Trentino-Alto Adige, 38051 , Italia",,,,
