b0be4f48bd76f02e7f7c5c26f7a33e66,2017-04-22T17:52:56+02:00,2017-04-22T17:52:56+02:00,"Torcegno: ponte di Cogno","Nel territorio comunale sono ancora operose due malghe con la produzione di latticini in proprio e per le quali è stato ottenuto il marchio Slow food per il formaggio di malga. Si rende indispensabile l'adeguamento della viabilita e il collegamento con la rete elettrica per dare risposta agli operatori che in quelle strutture lavorano. La richiesta, in continuo aumento, di chi intende raggiungere malga Setteselle o malga Mendana attrezzata con tre unita abitative si scontra con le normative di sicurezza della strada che di fatto risulta pericolosa e che necessita di importanti interventi di consolidamento e messa a norma. Questo progetto, che interessa il territorio del comune di Torcegno ma che va a servire malga Setteselle e malga Mendana nel comune catastale di Telve di Sopra, è di fondamentale importanza per il rifornimento delle succitate malghe e il raggiungimento da parte degli escursionisti della cima Sasso Rotto e dell'intera catena del Lagorai.Importo richiesto: Euro 250.000","Infrastrutturazione turistica",46.105479,11.421479,"torcegno, Trentino-Alto Adige, 38051 , Italia",,,,
aa8549085184e63f36b2eea27ca74874,2017-04-22T18:01:31+02:00,2017-04-22T18:01:31+02:00,"Comunita Valsugana e Tesino: collegamento ciclabile con il Tesino","L’accordo di partenariato 2014-2020 per l'impiego dei fondi strutturali e di investimento europei prevede per la Strategia Nazionale delle Aree Interne un Progetto pilota del Tesino per la realizzazione di una pista ciclopedonale (TESINO Ring). La costruzione di una pista ciclopedonale del Tesino non può prescindere da un collegamento dell'altipiano con la ciclabile della Valsugana. La Comunita Valsugana e Tesino propone dunque di realizzare questo collegamento, propedeutico agli interventi del progetto Aree interne del Tesino, attraverso la costruzione di alcuni tratti di pista ciclopedonale e per mountain bike da collegare e utilizzare in promiscuita a strade comunali esistenti. Lo sviluppo complessivo del nuovo tracciato, comprensivo delle strade comunali esistenti è di circa 5380 metri: dal ponte sul torrente Chieppena nel Comune di Castel Ivano (frazione di Ivano Fracena) e la ciclabile del Tesino nel Comune di Bieno.Importo richiesto: Euro 600.000",Ciclabili,46.061008,11.524444,"strigno, Trentino-Alto Adige, 38051 , Italia",,,,
bdb0511db49b0ebd5ae743ec55bbba9a,2017-04-22T18:05:42+02:00,2017-05-03T15:16:00+02:00,"Borgo Valsugana/Castelnuovo: Bike Park Valsugana","Realizzazione di un Bike Park presso il Centro sportivo di Borgo Valsugana con riqualificazione naturalistico ambientale di aree degradate (ex discariche) e dell’alveo di confluenza tra il fiume Brenta e il torrente Moggio, con collegamento dell’impianto alla gia esistente pista ciclabile della Valsugana. Il Bike Park è un complesso integrato per le attivita del ciclismo, comprendente ciclodromo, piste per RMX, mountain bike, ciclocross e cicloturismo, con la sola esclusione delle attivita che si praticano nei velodromi. Da sottolineare che la realizzazione del complesso integra la gia importante offerta del Centro sportivo di Borgo Valsugana ed è un’occasione di recupero di zone degradate, quali le cave dismesse. In sostanza la collocazione proposta si presta perfettamente allo scopo, sia per le caratteristiche tecniche che deve possedere la struttura sia per i costi di realizzazione assai contenuti. Per quanto riguarda la pista per il mountain bike, la presenza di saliscendi, dossi, pendenze assai ripide rende la struttura adatta anche per le competizioni. Da sottolineare infine che anche i Bike Park, come del resto le altre tipologie di impianti per il ciclismo, saranno organicamente collegati con il sistema di itinenari di cui al relativo Piano nazionale. Accanto al Bike Park si potra realizzare uno spazio destinato alla promozione dei prodotti agricoli e di allevamento della Valsugana e un punto di ristoro a km zero, nell’ottica di recupero, valorizzazione e promozione del territorio. (Comuni di Borgo Valsugana e Castelnuovo).Importo richiesto: Euro 600.000",Ciclabili,46.050078,11.47198,"Castelnuovo, Trentino-Alto Adige, 38051 , Italia",,,,
196d56950bcae23b714f9e7b66898086,2017-04-22T18:09:41+02:00,2017-04-22T18:09:41+02:00,"Ospedaletto: connessione ciclabile della Valsugana con il centro urbano","A oggi il paese di Ospedaletto non ha a disposizione un collegamento pedonale né ciclabile con la ciclabile di fondovalle che si trova sulla destra idrografica del fiume Brenta. Si possono prevedere due tratti che consentano l'accesso sia da ovest che da est. Si propone la realizzazione di un collegamento lungo via Barricata per chi giunge dalla direzione Bassano/Trento. Questa pedo-ciclabile inizierebbe all'altezza dell'incrocio tra via Barricata e via Prazzo per raggiungere il nuovo svincolo tra la SP 60 e la SS 47 per un totale di poco più di 700 metri. Da qui una strada comunale poco trafficata consentirebbe di raggiungere comodamente la ciclabile. Dalla direttrice Trento/Bassano invece si potrebbe costeggiare la SP 60 creando la pista ciclopedonale per meta sul lato a monte e per il resto sul lato a valle. Questo intervento prevede la sovracomunalita con Castel Ivano, visto che per meta il percorso si snoderebbe nel territorio di questo comune. L'intervento prevede scavi di sbancamento lungo la banchina della strada (lato destro a scendere) e la realizzazione del nuovo tracciato e la preventiva acquisizione delle aree interessate.Importo richiesto: Euro 250.000",Ciclabili,46.043614,11.552757,"Ospedaletto, Trentino-Alto Adige, 38051 , Italia",,,,
2b96970dbd581b11a9d3736822661ee3,2017-04-22T18:15:04+02:00,2017-04-22T18:15:04+02:00,"Scurelle: connessione ciclabile della Valsugana con il centro urbano","A seguito della realizzazione della ciclabile di fondovalle molti sono stati i comuni che hanno richiesto il collegamento con la stessa, attraverso percorsi riservati al solo transito dei velocipedi e dei pedoni. Uno di questi percorsi è stato proposto dal Comune di Scurelle, assieme al Comune di Carzano, lungo la stradina arginale del Torrente Maso. Il percorso si snoda dal parco fluviale di Carzano attraverso l'argine destro fino al Ponte della Palanca. Qui la ciclabile si sposta in sponda sinistra fino all'ex ponte delle Carette, nei pressi della SS47. Il collegamento con la ciclabile di fondovalle da questa localita è fattibile con due soluzioni. La prima prevede il passaggio della ciclabile oltre il nodo stradale della strada provinciale e della strada statale usufruendo dei sottopassi esistenti per il deflusso delle acque bianche e della roggia industriale di Scurelle; la seconda prevede l'innesto di questo percorso ciclabile nel nuovo marciapiede che dovrebbe essere realizzato a fianco della sede logistica EuroBrico per poi essere accompagnato con un sottopassaggio della SS47 fino alla stazione ferroviaria di Strigno. Da lì il percorso dovrebbe proseguire attraverso una strada di campagna esistente fino al ramale ciclopedonale che scende da Castel Ivano lungo l'argine destro del torrente Chieppena.Importo richiesto: Euro 400.000",Ciclabili,46.061056,11.499225,"scurelle, Trentino-Alto Adige, 38051 , Italia",,,,
bc02ddb73500f7226edfc6439d68c7fc,2017-05-03T15:33:38+02:00,2017-05-03T15:33:38+02:00,"Scurelle/Castelnuovo: Motopark Valsugana","
Si propone la realizzazione di un’area attrezzata per la pratica sportiva del trial e del quad. La struttura completerebbe l’offerta delle strutture sportive della valle e in particolare del vicino centro sportivo di Borgo Valsugana e consentirebbe agli appassionati di poter disporre di spazi autorizzati e sicuri per la formazione e per l’organizzazione di eventi agonistici. La disponibilita dell’impianto consentira inoltre l’addestramento dei volontari dei vigili del fuoco e del soccorso alpino interessati all'utilizzo di questi mezzi per le operazioni di loro competenza nei terreni impervi.La vicinanza con la pista ciclabile della Valsugana e con il Bike Park proposto dai comuni di Borgo Valsugana e Castelnuovo costituisce una valida integrazione e un forte valore aggiunto al progetto. (Comuni di Scurelle e Castelnuovo)Importo richiesto: Euro 150.000",,46.042438,11.494617,"Borgo Valsugana, Trentino-Alto Adige, 38051 , Italia",,,,
77513e3f115d7ba5f6588a9ec4328692,2017-05-03T15:39:05+02:00,2017-05-03T15:39:05+02:00,"Comunita Valsugana e Tesino: Rete turismo/cultura/territorio","
Il territorio della Valsugana orientale e del Tesino si caratterizza per una presenza importante di beni culturali e ambientali, di manifestazioni di rilievo e di poli museali minori e diffusi. Il punto di debolezza del sistema è dato dall’estrema frammentazione dell’offerta, che sconta la mancanza di una rete unitaria che, se attivata, costituirebbe una importante leva di promozione del territorio con finalita di uno sviluppo turistico e culturale complessivo.
Con l’avvento di tecnologie di facile accesso e diffuse capillarmente presso la maggior parte delle persone, le strutture museali, i beni culturali e ambientali, gli enti locali hanno la possibilita di disporre di strumenti estremamente potenti per dare corpo a nuove possibilita e modalita di fruizione dei propri spazi espositivi e delle proprie attivita. La tecnologia mobile possiede in particolare una serie di potenzialita, legate alla dimensione sociale, all’accessibilita e alla multimedialita, che ne fanno in prospettiva il fulcro di una nuova dimensione esperienziale della proposta culturale.
Il progetto, proposto dalla Comunita in collaborazione con Arte Sella, si concentra sull’utilizzo di tecnologie mobili al fine di rendere i luoghi della cultura, i beni culturali e ambientali fruibili, con la possibilita di narrare ai visitatori le singole esperienze senza vincoli temporali e senza la necessita di operatori disponibili all’apertura, costituendo nel contempo un’offerta unitaria di indubbio valore. Le tecnologie legate all’uso degli smartphone, ovvero le APP a livello software, abbinate all’impiego di hardware dedicati (ad esempio, la tecnologia NFC, il bluetooth a basso consumo o altre tecnologie innovative), permetterebbero al visitatore di vivere un’esperienza inedita, che dall’immaterialita del software è in grado di trasformarsi in un percorso di visita concreto e strutturato.
Con l’impiego di tali tecnologie di prossimita, il visitatore può accede al sito di interesse mediante una semplice combinazione hardware-software. Il sito è accessibile alla visita e alla valorizzazione dei siti ventiquattro ore su ventiquattro, essendo dotato di automatismi tali per cui l’utente, una volta installata l’apposita applicazione, possa accedere alla struttura, ai beni culturali e ambientali locali, eseguire e concludere una visita in assoluta autonomia, ricevere informazioni, il tutto assistito dalla tecnologia, anche per quanto riguarda l’offerta turistica (ristorazione, ricettivita, ecc.).
I vantaggi per il territorio sono evidenti: non vi è più la necessita di personale dedicato in orari di apertura non convenzionali, è possibile estendere la fruibilita e incrementare la qualita della visita intercettando un pubblico sempre più ampio, in particolare le fasce giovanili, gia abituate a un uso quotidiano e massiccio della tecnologia (si pensi alle attuali procedura di imbarco automatizzate negli aeroporti, ai pagamenti tramite smartphone, ecc...).Il budget necessario all’attivazione e messa a regime del progetto comprende le risorse umane necessarie (una persona), l’infrastrutturazione dei beni locali per adeguarli alla fruibilita garantita dal sistema, la predisposizione degli strumenti informatici necessari e la promozione del progetto a livello nazionale.Importo richiesto: Euro 500.000",,46.054653,11.460114,"Borgo Valsugana, Trentino-Alto Adige, 38051 , Italia",,,,
