remoteId,published,modified,Titolo,"Descrizione breve",Descrizione,"Tipologia di luogo",lat,lon,address,Immagine,Comune,Tags,Fonte,Indirizzo,"Indirizzo web",Email,Telefono,"Galleria immagini"
02c4f0996ea9f458cbd4db9d125458c6,2014-11-26T10:10:14+01:00,2014-11-26T10:10:14+01:00,"Castel Bragher ","Sorge presso la strada che da Taio sale a Coredo, in mezzo al bosco, su uno sperone roccioso delimitato da tre parti da profondi burroni, alla confluenza del Rio di Sette Fontane nel Rio di Val Solsa. Si può considerare la più complessa e singolare dimora feudale di tutto il Trentino. Il castello è abitato dal Conte che ne è il proprietario e dalla sua famiglia.","Il primo nucleo fu costruito nel 1270 da Bragherio di Coredo che ottenne dal principe vescovo il permesso di erigere una torre su quella roccia e di andarvi ad abitare, lasciando al fratello Paolo il castello di Coredo. Alla torre originaria, costruita tenendo conto soprattutto di esigenze militari, Bragherio aggiunse la torre di guardia. In seguito l'edificio passò ai Conti Thun. Nel secolo XVI fu ampliato e poi restaurato più volte. Ora è tra i castelli meglio conservati del Trentino. I vari corpi del fabbricato formano un insieme massiccio e movimentato. Il castello, imbiancato a calce, ha finestre bianche e rosse, i colori del casato dei Thun. Presso il cortile interno si trova la chiesa di S. Celestino, consacrata nel 1452; essa conserva un celebre ciclo di affreschi del Quattrocento.",Castello,0,0,,/var/predaia/storage/images/territorio/coredo/castel-bragher2/13510-1-ita-IT/Castel-Bragher.jpg,,,,,,,,
df212673296a8169b1edcb6d0d14c2c7,2014-11-26T10:13:49+01:00,2014-11-26T10:13:49+01:00,"Segheria Veneziana ","La vecchia Segheria Veneziana di Coredo, restaurata nel 1994, è un luogo dove si conserva una parte importante della cultura &quot;materiale” della Comunità di Coredo e dell'Altopiano della Predaia.","
In essa sono anche raccolti molti attrezzi originali che una volta erano utilizzati dai boscaioli per l’abbattimento delle piante, dai carrettieri per il trasporto dei tronchi, dagli squadrini, dai carpentieri e dai segantini per la trasformazione dei tronchi in tavole (assi), travi, travetti e cantinelle. Questi attrezzi e l'impianto stesso della segheria sono testimoni dell'esperienza e dell'inventiva tecnica degli uomini che lavoravano in questo settore importante dell'economia di montagna.La segheria è di proprietà del Comune di Coredo che la gestisce con l’aiuto di un gruppo di volontari, gli Amici della Segheria, che svolgono la loro attività a titolo gratuito con costanza e competenza e con grande passione.","Sito storico",0,0,,/var/predaia/storage/images/territorio/coredo/segheria-veneziana/13524-1-ita-IT/Segheria-Veneziana.jpg,,,http://www.segheriacoredo.it/index.htm|http://www.segheriacoredo.it/index.htm,,,,,
6faeba92c6909a536037a33d3ee626be,2014-11-26T10:24:18+01:00,2014-11-26T10:25:38+01:00,"Chiesa Santa Maria Assunta ","Già dal 1284 antica pieve, fu rifatta in stile gotico nel 1407 e riedificata negli anni 1759-62 in stile rinascimentale - barocco di cui è uno dei pià splendidi modelli nella Valle. ","Possiede 5 altari in marmo policromo costituiti nel 1764. Le relative pale dell'epoca sono di notevole pregio e in modo particolare quella dell'altare maggiore di V.Italiani di scuola veneta, che rappresenta l'Assunzione, cui è dedicata la chiesa; da ammirare sono pure le tavole della Via Crucis, opere del pittore A. F. Vanzo di Cavalese, ultimate nel 1819.Parroco: Don Franco Torresani













",Chiesa,0,0,,/var/predaia/storage/images/territorio/smarano/chiesa-santa-maria-assunta/13538-1-ita-IT/Chiesa-Santa-Maria-Assunta.jpg,,,,,,,"0463 536184",
46f35655a64c51006f9dd2cf42ee63a5,2014-11-26T11:28:21+01:00,2014-11-26T11:28:21+01:00,"Chiesa di San Vittore ","Una tradizione vuole che la chiesa di Taio fosse aggregata alla basilica di S. Vittore di Milano e che il vescovo Ambrogio abbia mandato le reliquie di questo santo al vescovo di Trento, Vigilio (V secolo). ","La prima documentazione storica risale al 1276, anno in cui il vescovo Enrico III conferma i privilegi della chiesa. Negli atti visitali del 1537 la chiesa risultava priva di ogni ornato e il pievano Cosma de Mariani si giustificava col fatto che i parrocchiani avevano dovuto sopportare ingenti spese per l’erezione del campanile. Nei secoli successivi vengono aggiunti gli altari e la pala, rappresentante il martirio di San Vittore dipinta da M. Lampi. Nel 1845 la chiesa, angusta per l’aumentata popolazione e cadente, venne demolita e ricostruita nella forma attuale mantenendo solo il coro. Venne consacrata nel 1850 dal ven. (ora beato) Giovanni Neponuceno de Tschiderer. Contestualmente fu spostato fuori dell’abitato il cimitero che la cingeva. Ora ha tre altari. L’altare maggiore in marmi policromi e ciborio è del 1876, opera dello Scanogatta di Rovereto. Quello a sinistra con quattro colonne di marmo fu fatto erigere nel 1703 dal parroco Valentino Chilovi, di cui riporta lo stemma nobiliare; quello a destra fu fatto erigere nel 1684 da Giuovanni Panizza. La pala raffigura un angelo che libera un’anima dal purgatorio e reca lo stemma nobiliare. Sul lato sinistro del presbiterio c’è la pala del 1755 raffigurante il martirio di S. Vittore dipinta da Mattia Lampi. 
La struttura massiccia del campanile si erge di poco staccata dalla chiesa di San Vittore. E’ a pianta quadrata (lato di ml. 7.35 e ml.6.85, rispettivamente alla base e all’altezza della cella campanaria). La notevole altezza (ml. 43.30 alla sommità della croce) è resa meno evidente dalle massicce dimensioni trasversali, dai sottili marcapiani e dalle ampie monofore della cella campanaria.
Lo spessore dei muri varia fra 1.60 ml. alla base e 1 ml. all’altezza delle monofore. Il tetto ha la copertura in scandole di larice. 
La costruzione può essere datata secondo le piccole lapidi poste a diverse altezze sulla facciata ovest dell’edificio. La prima, a circa 2.50 ml. dal suolo, reca la data MCXXVI; la seconda, a ml. 16.50, il 1531 mentre la terza, su di una pietra dell’orologio porta la scritta ‘164’, di cui l’ultima cifra risulta ormai illeggibile. La porta sopraelevata (ma ancora visibile), le strette feritoie e la forma massiccia fanno pensare che il campanile, oltre alla funzione religiosa, avesse anche quelle civiche e di difesa. ",Chiesa,0,0,,/var/predaia/storage/images/territorio/taio/chiesa-di-san-vittore/13574-1-ita-IT/Chiesa-di-San-Vittore.jpg,,,,,,,,
656d97d80aac02fa4777b3cf0cdc75dd,2014-11-26T11:29:07+01:00,2014-11-26T11:29:07+01:00,"Chiesa di Santa Maria ","La chiesa come giunta fino a noi è frutto di numerosi rifacimenti."," La parte più antica risale di sicuro al secolo XII ma il primo documento scritto è del 1255. Nel 1500 fu ampliata e venne aggiunto il controsoffitto in stile gotico. La facciata presenta un interessante portale in stile romanico in pietra viva e al vertice un campaniletto costruito, con ogni probabilità, in occasione dell’ampliamento cinquecentesco della chiesa. Molto interessante è la facciata a mezzodì che presenta, ancora visibili, tracce di affreschi databili all’inizio del sec. XIV raffiguranti la Madonna seduta ed incoronata e di lato, una testa di uomo. Il portale è di tipo romanico sormontato da una lunetta in pietra ornata di un Ecce tomo. Sul lato nord è da notare l’architrave cinquecentesca di un’antica finestra, ora murata, finemente lavorata con gli stemmi dei Tono e dei Roccabruna. L’interno è a una navata illuminata da finestre rettangolari: ha tre altari in legno riccamente scolpiti e dorati dedicati alla Madonna del Rosario, all’Assunta e alla Madonna e San Sebastiano. ",Chiesa,0,0,,/var/predaia/storage/images/territorio/taio/chiesa-di-santa-maria/13588-1-ita-IT/Chiesa-di-Santa-Maria.jpg,,,,,,,,
18aa8e09aec9d83777057f882050b642,2014-11-26T11:30:32+01:00,2014-11-26T11:30:32+01:00,"Chiesa dei Santi Filippo e Giacomo ","Su di uno sperone di roccia a valle dell’abitato storico di Dermulo sorge la vecchia chiesa non più aperta al culto dopo la costruzione, agli inizi degli anni cinquanta, di quella nuova in prossimità del bivio delle strade statali per Cles e Fondo.","La chiesa è menzionata già nel quattrocento ma è senz’altro anteriore. La sua ricostruzione nella forma attuale è del 1677, come indicato dall’iscrizione di una lapide. E’ divisa in due piccole campate e sull’impianto romanico è stata costruita la volta gotica mentre il portale è di stile rinascimentale. Il campaniletto di stile gotico è interno alla facciata della chiesa e il timpano inferiore costituisce l’atrio della stessa. Prima dell’ultimo restauro della chiesa si notavano tracce di antichi affreschi. Ha tre altari in legno intagliato e dorato. Quello principale è del 1616 ed è dedicato ai santi apostoli Filippo e Giacomo; quello di sinistra, del 1979, ha un’immagine dell’Immacolata mentre quello di destra ha una pala con l’immagine della Madonna e di S. Bartolomeo. Nella sacrestia è conservata la tavola gotica rappresentante la Madonna tra S. Giustina e S. Cipriano proveniente dalla demolita chiesetta dell’Eremo di S. Giustina, restaurata nel 1935. ",Chiesa,46.339064,11.062925,"dermulo ",/var/predaia/storage/images/territorio/taio/chiesa-dei-santi-filippo-e-giacomo/13602-1-ita-IT/Chiesa-dei-Santi-Filippo-e-Giacomo.jpg,,,,,,,,
def293d422970039cf34fcc95d36946f,2014-11-26T11:32:01+01:00,2014-11-26T11:32:01+01:00,"Chiesa parrocchiale di Santa Giustina ","La chiesa sorge al bivio della S.S. 43 per il Tonale e per la Mendola. E’ stata costruita nel 1954 in stile tradizionale con un portico sui lati est e nord e con un caratteristico campanile a lunga cuspide su disegno dell’arch. Efrem Ferrari. ","All’interno una bella trova posto una bella tavola gotica del XV secolo sull’altare maggiore, proveniente dalla vecchia chiesa. Vi è inoltre un secondo altare dedicato a San Pio X, riformatore della musica sacra, alla cui promozione e diffusione ha contributo il conosciuto mons. Celestino Eccher (1892-1970) originario di Dermulo. ",Chiesa,46.339064,11.062925,dermulo,,,,,,,,,
6d07fcf0370a7930cdac92556bce94df,2018-10-01T11:18:06+02:00,2018-10-01T11:21:36+02:00,"Predaia Running Park","Un Parco tematico per gli amanti della corsa, con percorsi per neofiti e per progrediti in uno scenario naturale di una bellezza incontaminata.","I tre percorsi hanno tutti il punto di partenza presso il Parcheggio del Maneggio Agostini nella frazione di Tavon a 1 Km da Coredo.

    Volantino con informazioni e consigli utili


    Volantino con la descrizione dei tre percorsi
Ulteriori informazioni:Articolo dedicato dal blog di Pineta Hotels  ",Percorso,0,0,,/var/predaia/storage/images/territorio/cosa-visitare/predaia-running-park/157601-1-ita-IT/Predaia-Running-Park.png,,,,,,,,
28cd1ce2006d4f0824f4cfaab88b1dc8,2014-11-26T12:53:03+01:00,2021-08-19T14:22:09+02:00,"Area sosta camper (Batuda)","A monte del paese di Tres, immersa in un vasto parco con giochi e punti di fuoco per pic-nic, è stata realizzata un’area attrezzata per la sosta di camper. La zona è circondata da un rigoglioso bosco ricco di percorsi accessibili a tutti e particolarmente interessanti da punto di vista naturalistico e storico.Per ulteriori informazioni CLICCARE QUI  .",,,46.321677,11.095507,"TRES,TN ",/var/predaia/storage/images/territorio/comuni/tres/area-sosta-camper-batuda/13770-1-ita-IT/Area-sosta-camper-Batuda.png,,,,,,,,
