remoteId,published,modified,Titolo,"Descrizione breve",Descrizione,"Tipologia di luogo",lat,lon,address,Immagine,Comune,Tags,Fonte,Indirizzo,"Indirizzo web",Email,Telefono
1b9c8a66bd3461f2145f3b848a49175d,2014-06-18T17:16:52+02:00,2014-06-18T17:16:52+02:00,"Lardaro - Madonnina di Campel","Da Lardaro, lungo la stradina asfaltata a sud del paese, raggiunto il bivio dopo aver attraversato il ponticello sul Torrente Adanà, la strada sale un pò tortuosa fino a raggiungere la località Paul Dasta, godendo del bel panorama che circonda questa conca; si prosegue poi alla volta della località Brec e su fino a Plazzola; dopo poco incontriamo il capitello votivo della Madonnina di Campel, meta un tempo di pellegrinaggio, oggi solo di questa splendida passeggiata. Tempo di percorrenza: 1 ora circa.",,"Sentieri e itinerari",45.969675,10.661059,lardaro,,,,,,,,
c4cb6b95e9b8032e611952f15e0bd5a6,2014-06-18T17:17:51+02:00,2014-06-18T17:17:51+02:00,"Lardaro - Conca di Cherio","Lasciato Lardaro sempre a sud, dopo aver attraversato il Torrente Adanà, percorriamo la stradina che svolta a sinistra e serpeggia nei prati fino a giungere alla località Bondaione. La strada man mano si restringe fino a divenire un sentiero che si inoltra nel bosco in località la Vecchiarella fino a salire nella bella conca di Cherio, costellata di prati e suggestive baite. Tempo di percorrenza: 1 ora circa.",,"Sentieri e itinerari",45.969675,10.661059,lardaro,,,,,,,,
7335a2d6683c3c50f63becc3206193b3,2014-06-18T17:18:59+02:00,2014-06-18T17:18:59+02:00,"Lardaro - Località Carriola","Da Lardaro si percorre la comoda strada a sud dell’abitato che svoltando a destra, si accomoda nella campagna e dolcemente sale fino alla località Prapur. Da qui si prosegue fin dove la strada diviene una panoramica balconata sulla Valle del Chiese fino al Lago d’Idro e la Val di Daone; si giunge poi alla località Carriola dove è possibile visitare il Forte omonimo. Tempo di percorrenza: 2 ore circa.",,"Sentieri e itinerari",45.969675,10.661059,lardaro,,,,,,,,
ef3a21dcd04f8c3f9e3012a5a0f1f598,2014-06-18T17:20:25+02:00,2014-06-18T17:20:25+02:00,"Lardaro - Forte Corno","Risalendo la Valle del Chiese, lasciato il paese di Lardaro alle spalle, attraversando la statale si raggiunge, in pochi minuti, percorrendo una stradina bianca, alla località Vanecle, con le sue caratteristiche baite e poco dopo, arrampicandosi sulla costa, si giunge alla località Gande da cui si gode uno splendido panorama; si prosegue camminando sulla strada militare realizzata durante il primo conflitto mondiale fino a giungere al Forte Corno, che oltre ad essere un testimone di quello che fu il grande complesso difensivo di Lardaro, offre un panorama di rara suggestione su tutto il circondario. Tempo di percorrenza: 1 ora circa.",,"Sentieri e itinerari",45.969675,10.661059,lardaro,,,,,,,,
51746a5bdb7513e6d183ecb8d2a6bf50,2014-06-19T12:28:07+02:00,2014-06-19T12:28:07+02:00,"Forte Larino","Erede di un passato storico tanto significativo quanto tragico, la Valle del Chiese conserva ancora oggi i segni profondi e le testimonianze più dirette della Prima Guerra Mondiale.","
Lungo l’antica linea difensiva che durante il conflitto, scendendo dal Gruppo dell’Adamello, si estendeva orizzontalmente tagliando in due la vallata, forti, trincee, linee di sbarramento e mulattiere evocano con grande potenza drammatica la dimensione degli eventi bellici, che videro i soldati delle armate austriache fronteggiarsi con quelli dell’esercito italiano.
Testimoni possenti della Grande Guerra sono sicuramente i forti, messi a guardia delle linee austro-ungariche. Dei cinque originali che formavano lo “Sbarramento di Lardaro” ne rimangono tre: Forte Larino a sud di Lardaro, Forte Corno nel Comune di Praso e Forte Carriola dei territori di Pieve di Bono. Originariamente collegati fra loro da una serie di camminamenti, trincee e gallerie, andavano a comporre un imponente sistema difensivo, che dominava e controllava la Valle del Chiese dall’alto, e rappresentano ancora oggi un’affascinante e suggestiva manifestazione della progressive evoluzioni del genio militare austriaco.
Forte Larino, conservato in ottimo stato, fu costruito tra il 1860 e il 1862 su uno sperone che scende dal Doss dei Morti verso il fondovalle, a occidente della strada statale che sale verso Lardaro.Il complesso ha una superficie di un migliaio di metri quadrati ed è costituito da una batteria casematte, da due batterie in terra e da un fabbricato ad uso magazzino e caserma.",Forte,45.964273,10.658767,"lardaro forte larino",,,,http://www.visittrentino.it/it/cosa_fare/da_vedere/dettagli/dett/forte-larino|VisitTrentino,,,,
