remoteId,published,modified,Titolo,"Descrizione breve",Descrizione,"Tipologia di luogo",lat,lon,address,Immagine,Comune,Tags,Fonte,Indirizzo,"Indirizzo web",Email,Telefono
0b9b17396b716455580f5a7641712771,2014-04-02T16:18:02+02:00,2018-09-11T15:46:38+02:00,"Centro Canoa","E' possibile dalla primavera all'autunno usufruire del percorso attrezzato sul torrente Noce per canoa slalom.",,Canoa/Kayak,0,0,,,,,,,,,
647fd4eff445a8013442c026ab2ca63f,2014-04-02T16:19:31+02:00,2014-04-02T16:19:31+02:00,"Funivie Folgarida Marilleva S.p.A.","


ufficio Marilleva 900: tel. 0463 757103

biglietteria Marilleva 1400: tel. 0463 796190

per informazioni su impianti e piste di Folgarida, Marilleva e Pejo: info@ski.it

web : www.ski.it.


",,,0,0,,,,,,,,,
f1e07a49f0f5fd98ee1141db67cc24ff,2014-04-03T10:10:58+02:00,2014-06-05T15:35:34+02:00,Roncio,"Piccolo paese di montagna a quota 1051, con chiesetta del XVI secolo recentemente restaurato, costruito su un terrazzamento naturale che domina il fondovalle, presenta costruzioni tipiche della tradizione solandra, con muri in pietra autoctona fino al primo piano e strutture lignee nella parte soprastante.",,,46.32137,10.80934,Roncio,,,,,,,,
470953ed87a1d438e4de038ef40ff71f,2014-04-03T10:13:26+02:00,2018-05-22T13:50:57+02:00,"Marilleva Novecento","Nata come stazione di partenza degli impianti che dal fondovalle raggiungono quota 1400, dispone di diversi alberghi, bar, pizzerie, ristoranti, esercizi commerciali e ampi parcheggi tali da soddisfare le esigenze dei molti turisti che vi soggiornano, sia nel periodo invernale che estivo.",,,46.31527,10.81219,"Marilleva 900",,,,,,,,
b21033264f989630f017c69b924cb362,2014-04-03T10:12:23+02:00,2020-06-24T11:21:05+02:00,"Ortisè e Menas","I due piccoli e suggestivi paesi di Ortisè e Menas sorgono sul versante contrapposto a Marilleva Millequattrocento, rispettivamente a quota 1479 e 1512. Il rio Valletta separa i due paesi posti su uno sperone di monte al cospetto di uno spettacolare panorama. In questi ultimi anni vecchie case e rustici sono stati, nel rispetto delle tradizioni, trasformati in accoglienti abitazioni, con interesse anche turistico. Sono da segnalare la chiesa parrocchiale di S. Cristoforo del XVI secolo e la chiesetta di S. Rocco del XV secolo, ubicata fra i due paesetti. Va inoltre ricordato che Ortisè ha dato i natali a don Giacomo Bresadola (1847-1929), insigne micologo di fama mondiale.",,,46.326339,10.78332,Ortis&egrave;,/var/mezzana/storage/images/territorio/luoghi-e-punti-di-interesse/frazioni/ortise-e-menas/13513-3-ita-IT/Ortise-e-Menas.jpg,,,,,,,
5c56f9090608c0f83c7dc99adbd18c52,2014-04-03T10:14:36+02:00,2020-06-24T11:20:09+02:00,"Marilleva Millequattrocento","Costruita dopo il 1968, a quota 1400 mt., tra fitte abetaie, è raggiungibile sia con la strada provinciale 206 che parte da Mezzana, sia con la telecabina che parte da Marilleva Novecento. I grossi complessi presenti sono dotati di tutti i servizi ed i conforts di una moderna stazione turistica, comprese due scuole di sci, diversi negozi per vendita, noleggio e riparazione di attrezzature sportive. Le numerose piste da sci, dotate anche di impianti di innevamento artificiale, presentano vari gradi di difficoltà e si collegano in quota con gli impianti di risalita di Folgarida e Madonna di Campiglio con cui formano un notevole &quot;circuito bianco&quot; sulle pendici delle montagne circostanti.",,,46.301553,10.810622,"Marilleva 1400",,,,,,,,
